,title,salary,city,job,publish_date,requirements,responsibilities,schedule,experience,employment,url,Job
877,Middle IOS-разработчик,1100000 - 1700000 KZT,Алматы,Колеса,13-07-2023,"Умение верстать кодом и в Interface Builder с Autolayout в соответствии с дизайном. Умение дебажить, докапываться до причин багов и...","Проводить code review или иногда программировать парно. Покрывать код unit-тестами. Проводить рефакторинг и своего, и легаси-кода. ",,От 1 года до 3 лет,Полная занятость,https://hh.ru/vacancy/83370310,Programmer
878,Программист разработчик backend/full stack,400000 KZT,Алматы,iSME,08-07-2023,"Знание алгоритмов, структур данных и принципов выбора эффективных решений. Понимание реляционных БД, знание PostgreSQL +. Понимание основ и принципов ООП...",Участие в разработке серверного кода. Разработка и создание продвинутых микросервисов. Интеграция сторонних приложений. Интеграция внутренних и внешних API. ,,От 1 года до 3 лет,Полная занятость,https://hh.ru/vacancy/83175386,Programmer
879,Разработчик 1С,800000 KZT,Алматы,ОБИС,21-07-2023,Необходим опыт работы 2ух лет и выше. Знание типовых конфигураций. Опыт конфигурирования прикладных решений. Сертификат не ниже уровня Профессионал...,Сопровождение и доработка текущих прикладных решений. Поддержка и консультации пользователей. Доработка подсистем и модулей существующих конфигураций; на базе платформы 1...,,От 3 до 6 лет,Полная занятость,https://hh.ru/vacancy/83791020,Programmer
880,"Fullstack-разработчик (Python, vue.js)",150000 - 500000 KZT,Астана,Центрсофт Solution,13-07-2023,"Технический английский, умение работать с документацией. Рассматриваем кандидатов с опытом работы.","Участие в разработке IT продуктов для бизнес-процесса Компании. Требования: - Разработка функционала UI для тиражного решения, предназначенного для автоматизации бизнес...",,От 1 года до 3 лет,Полная занятость,https://hh.ru/vacancy/83365469,Programmer
881,International Business Development Manager,500000 KZT,Алматы,PingOcean (ПингОушен),29-06-2023,"Bachelor’s degree qualified (or equivalent) in Business Development, Sales or Marketing (preferred) or related discipline. Excellent English speaking skills. ",Cooperate with BD functions. Consistently building and delivering an accurate opportunity pipeline. Assisting with executing short and long-range sales...,,От 1 года до 3 лет,Полная занятость,https://hh.ru/vacancy/82761050,Programmer
882,Back End разработчик (PHP Laravel),,Алматы,Thousand IT Company,21-07-2023,"Знание принципов построения и работы сайтов, серверов. Проектирование и разработка REST API. Профессионализм, ответственность, компетентность, готовность развиваться и постигать новое.","Доработка и разработка новых внешних и внутренних WEB-проектов, мобильных приложений и др. Разработка проектов на PHP (Laravel). ",,От 1 года до 3 лет,Полная занятость,https://hh.ru/vacancy/82238159,Programmer
883,Java-разработчик (Middle/Senior),,Астана,Национальные информационные технологии,29-06-2023,"Высшее профессиональное образование (Технические науки и технологии). Знание одного из фреймфорка для автоматизации сборки проектов (maven, gradle, ant). ","Разработка, модификация конфигурации проекта. Поддержка ПО.",,От 3 до 6 лет,Полная занятость,https://hh.ru/vacancy/82712540,Programmer
884,Golang разработчик,600000 - 1100000 KZT,Алматы,OneVision,05-07-2023,"Git. Golang. Postgres. Clickhouse. Redis. Docker, docker-compose. Kubernetes.",Разработка информационных систем с нуля. Исправление багов. Разработка новых фич. Код ревью. Обмен опытом с командой. Написание dockerfile для образов...,,От 3 до 6 лет,Полная занятость,https://hh.ru/vacancy/83010894,Programmer
885,Middle Frontend Developer,300000 - 500000 KZT,Алматы,МАУЛЬШАРИФ,30-06-2023,"Знание React + TS, React Query, React Hooks, i18next. Знание @mantine/forms +hooks + dates. Знание Vite.js. ",Разработка админской части сайта. Оценка задач и их выполнение. Внедрение новых технологий и практик.,,От 1 года до 3 лет,Полная занятость,https://hh.ru/vacancy/82842578,Programmer
886,Backend-разработчик (Node.js),,Алматы,Аврора Холдинг,05-07-2023,"Умение разбираться в чужом коде. Оценка и планирование рабочего времени. Соблюдение основных принципов программирования, такие как DRY, SOLID и тд.",Писать сервер на Node.js. Разработка highload систем. Доработка и оптимизация существующих систем. Разработка новых микросервисов и модулей.,,От 1 года до 3 лет,Полная занятость,https://hh.ru/vacancy/77943289,Programmer
887,Программист,,Алматы,MFO BNK Finance Kazakhstan,13-07-2023,"Знание теории реляционных баз данных. Умение читать, расписывать техническое задание. Образование - высшее или средне-специальное. Знание языков: SQL, PL/SQL...","Автоматизация с помощью SQL, PL/SQL, Oracle. Поддержка пользователей. Тестирование разработок. Основы работы с БД: Oracle.",,От 1 года до 3 лет,Полная занятость,https://hh.ru/vacancy/83369047,Programmer
888,Front-end Developer,,Астана,Grintern,20-07-2023,"Completed bachelor's degree in Computer Science, Engineering, or related field, or equivalent training, fellowship, or work experience. ","Front-end development tasks, working on the front end of the main web application. Building robust, well-tested services and...",,От 3 до 6 лет,Полная занятость,https://hh.ru/vacancy/83749909,Programmer
889,Senior Python разработчик,,Алматы,Globerce Inc.,29-06-2023,Python 3.6-3.8. Опыт работы с Django/Flask/FastApi. Опыт работы с DRF. Умение писать асинхронный код с...,Разработка web части сайтов на Django. Разработка REST сервисов на DRF. Разработка async сервисов. Разработка клиентов для работы со сторонними...,,От 3 до 6 лет,Полная занятость,https://hh.ru/vacancy/82772989,Programmer
890,IT-специалист / Веб-дизайнер / Фронтенд-разработчик,200000 KZT,Шымкент,PHYTO-APIPHARM,13-07-2023,"1. Опыт работы на аналогичной должности не менее 2-3 лет. 2. Глубокие знания HTML, CSS, и JavaScript. 3. ","1. Обеспечивать надлежащее функционирование и обслуживание компьютеров и оргтехники в организации. 2. Разрабатывать и поддерживать веб-сайт компании, обеспечивая удобный...",,От 1 года до 3 лет,Полная занятость,https://hh.ru/vacancy/83394729,Programmer
891,Программист Colvir,400000 - 600000 KZT,Астана,Исламский банк Заманбанк,14-07-2023,"Отличное знание АБИС Colvir. Отличное знание языка PL/SQL, SQL. Отличное знание банковских бизнес-процессов. Умение работать с JSON, XML. ","Разработка и поддержка функционала АБИС Colvir. Поддержка действующих модулей: РКО, Бухгалтерия банк, Гарантии, Регуляторная отчетность, Платежная система, Главная книга и...",,От 1 года до 3 лет,Полная занятость,https://hh.ru/vacancy/83436123,Programmer
892,Distributor Development Manager (Consumer Products Division),,Алматы,Лореаль Казахстан,20-07-2023,Наличие соответствующего опыта работы. Знание английского языка.,"Управление отделом по развитию дистрибьюции (работа с командой). Ответственность за развитие деловых, партнерских отношений с дистрибьюторами. Реализация совместного планирования закупок...",,Более 6 лет,Полная занятость,https://hh.ru/vacancy/83736572,Programmer
893,Специалист (программист) поддержки,,Костанай,ТОО «Забота Company LTD,19-07-2023,Опыт работы программистом 1С (желательно в сфере розничной торговли) от 1 года. Ответственность и оперативность в решении задач.,Выполнение текущих заявок от пользователей программы 1С в области розничной торговли/работы с торговым оборудованием. Создание учётных записей для...,,От 1 года до 3 лет,Полная занятость,https://hh.ru/vacancy/83697465,Programmer
894,IOS Developer,,Алматы,Народный банк Казахстана,05-07-2023,"Уверенное владение Swift. - Уверенное знание iOS SDK, Xcode, опыт работы с основными iOS фреймворками. - Опыт использования одной из архитектур: MVP...",,,От 1 года до 3 лет,Полная занятость,https://hh.ru/vacancy/83026702,Programmer
895,Front-end разработчик (удаленно),,Астана,Частная компания Retail Robotics Solutions - R&D Ltd.,12-07-2023,"отличное знание JavaScript, HTML, CSS. - уверенное знание TypeScript. - хорошее знание библиотеки React и опыт ее использования в коммерческих проектах не...","разработка и поддержка продукта компании. - проведение код-ревью. - оценка трудоемкости задач. - взаимодействие с другими участниками командами: back-end разработчиками, devops...",,От 3 до 6 лет,Полная занятость,https://hh.ru/vacancy/83336554,Programmer
896,Верстальщик | HTML/CSS Developer,,Павлодар,Публичная Компания «Freedom Finance Global PLC»,05-07-2023,Опыт в сфере веб-разработки от 2 лет. Экспертные навыки в адаптивной кроссбраузерной верстке.,"Верстка макетов созданных в графических редакторах (figma, photoshop). Доработка текущих проектов, внесение правок. Адаптивная верстка. Работа в команде.",,От 1 года до 3 лет,Полная занятость,https://hh.ru/vacancy/83039974,Programmer
897,Backend/Fullstack разработчик,600000 - 800000 KZT,Астана,Центр развития трудовых ресурсов,12-07-2023,"Образование: высшее техническое (обязательно). Знание и опыт работы с Java , AngularJS, npm, MyBatis, spring,Oracle - обязательно, Gitlab - желательно. ",Разработка. - Выполнение модификации. - Доработка функционала.,,Более 6 лет,Полная занятость,https://hh.ru/vacancy/83334783,Programmer
898,Middle Frontend developer (React/TypeScript),,Алматы,DAR tech,29-06-2023,Опыт работы c React / TypeScript. Опыт разработки сложных продуктов от 3х лет. Иметь опыт работы в команде разработчиков и...,"Писать стабильный, поддерживаемый код, который решает задачи бизнеса. Управлять командой фронтенд разработчиков. Участвовать в найме. Участие в процессах и общих...",,От 3 до 6 лет,Полная занятость,https://hh.ru/vacancy/81442915,Programmer
899,Разработчик Python,450000 - 590000 KZT,Алматы,"ProMebel, ТМ (ТОО IDIA Market)",24-07-2023,"Опыт программирования на Python. Знания СУБД PostgreSQL. Опыт работы с django или другим python web framework. Знание основ HTML, CSS. ","Внедрение автоматизации и цифровизации. Разработка ERP системы на платформе Odoo. Анализ потребностей, разработка и внедрение новых процессов.",,От 1 года до 3 лет,Полная занятость,https://hh.ru/vacancy/82822848,Programmer
900,Разработчик отдела информационных систем коммуникации,,Алматы,Home Credit Bank,16-07-2023,Опыт работы в сфере информационных технологий не менее одного года. Опыт программирования СУБД (системы управления базами данных). Знание языков программирования...,"Составлять план работ в рамках исполнения задачи по разработке и внедрению программного обеспечения. Осуществлять контроль качества программного кода, разрабатываемых решений. ",,От 1 года до 3 лет,Полная занятость,https://hh.ru/vacancy/83496585,Programmer
901,Backend-разработчик PHP,700000 - 2000000 KZT,Алматы,Колеса,24-07-2023,"Хорошие знания PHP. Знакомство с инфраструктурой: Linux, Docker, Nginx. Знания базы данных: MySQL (обязательно), MongoDb, Redis. Умение работать с git...",Развитие и поддержка лучших IT-продуктов Казахстана. Создание нового и оптимизация работы имеющегося функционала. Повышение надежности и качества системы на...,,От 1 года до 3 лет,Полная занятость,https://hh.ru/vacancy/66646946,Programmer
902,Управляющий Бизнесом (Business Development Manager),,Алматы,Kaspi.kz,11-07-2023,"Высшее оконченное образование (любое направление). Опыт работы в продажах профессиональных услуг B2B c торговыми партнерами, дилерами, региональные представительствами. ","Курирование работы в части развития партнеров, путем проведения переговоров с партнерами с целью увеличения объёмов продаж партнеров и доходов. ",,От 3 до 6 лет,Полная занятость,https://hh.ru/vacancy/83259321,Programmer
903,Веб-разработчик,,Актобе,Dina market,04-07-2023,Наличие опыта работы от 3 лет в веб-разработке — Уверенное владение всеми технологиями веб-разработки. Наличие опыта работы от 3...,"Выполнение задач и сайты, веб-сервис. Интеграция верстки с программным кодом. Поиск и использование новых веб технологий для решения задач.",,От 1 года до 3 лет,Полная занятость,https://hh.ru/vacancy/82959435,Programmer
904,"Программист PowerApps, PowerBI",500000 KZT,Астана,Торговый дом ТТС,23-07-2023,Образование - высшее профессиональное в области: - компьютерные науки или смежные области. - менеджмент информационных технологий. - инженерия. Опыт работы - Опыт управления проектами от...,,,От 1 года до 3 лет,Полная занятость,https://hh.ru/vacancy/83538509,Programmer
905,Разработчик баз данных,,Алматы,InformConsulting,14-07-2023,"Опыт работы на аналогичной должности от года в коммерческих проектах. Навыки, знания и практический опыт в области систем управления базами...",Разрабатывать скрипты для отчетов. Оптимизировать запросы. Делать выборки данных. Выполнять миграции и слияния БД. Заниматься анализом данных. Проектировать БД. ,,От 3 до 6 лет,Полная занятость,https://hh.ru/vacancy/83447108,Programmer
906,"Developer PHP, C, C# JavaScript",800 USD,Алматы,Cimetrics,18-07-2023,"Понимание разработки веб-приложений – backend on Linux. - Опыт в разработке web-frontend (html, CSS, http). - Готовность изучать новые платформы, технологии...",Платформа:,,От 3 до 6 лет,Полная занятость,https://hh.ru/vacancy/83586980,Programmer
907,Backend разработчик/Программист (strong junior / middle),350000 - 500000 KZT,Актобе,Oktrening,20-07-2023,,"3. Вам нужно будет попунктно выполнять задачи по разработки функционала, так же тестировать, выявлять баги и устранять их, достигая поставленных...",,От 1 года до 3 лет,Полная занятость,https://hh.ru/vacancy/83760920,Programmer
908,C# Developer (Senior/Middle),1000000 KZT,Алматы,FinTechPro,22-07-2023,"Знание # ASP.NET\ASP.NET Core - опыт разработки коммерческих проектов. Опыт разработки монолитного\многоуровневого приложения. Знание паттернов - MVC, Repository. ",,,От 3 до 6 лет,Полная занятость,https://hh.ru/vacancy/83380369,Programmer
909,Разработчик Golang,,Алматы,Astana-Plat,17-07-2023,"Уверенное знание Golang, PHP. Опыт работы Kafka , SQL, Rest, GRPC, NoSQL и Embedded базами. Понимание принципов SOLID. Навыки работы с...","Разработка нового функционала для информационных систем компании (финтех). Устранение недостатков в старом функционале, рефакторинг и код ревью. Разработка новых и...",,От 3 до 6 лет,Полная занятость,https://hh.ru/vacancy/83513156,Programmer
910,Embedded system developer / Разработчик встраиваемых систем,200000 - 400000 KZT,Астана,NTS design,24-07-2023,Отличное знание языка C/C++. Опыт разработки встраиваемого ПО для серийных изделий на базе MCU STM32 (32-bit ARM...,"Разработка встраиваемого ПО для микроконтроллеров (МК): STM, Atmel и др.. Сбор данных с разных устройств с низкоуровневым выводом (АЦП, GPIO...",,От 1 года до 3 лет,Полная занятость,https://hh.ru/vacancy/83592481,Programmer
911,Разработчик Power BI,,Астана,КАЗАХСТАНСКИЙ ОПЕРАТОР РЫНКА ЭЛЕКТРИЧЕСКОЙ ЭНЕРГИИ И МОЩНОСТИ,13-07-2023,"Обязателен опыт работы с Power BI, Power Query и Power Pivot. Знание баз данных и SQL. Проактивный подход к задачам...","Управление проектом по внедрению Power BI. Разработка витрин и моделей данных. Разработка отчетов и визуализаций. Проектирование, разработка и оптимизация хранилищ...",,От 1 года до 3 лет,Полная занятость,https://hh.ru/vacancy/83383444,Programmer
912,Senior Java developer,,Алматы,Khan Group,24-07-2023,"Знание и умение работать с Java, JavaEE, Spring, Spring Boot, MySQL. Знание и умение использовать различные алгоритмы, структуры данных. ",Выступать экспертным специалистом (код ревью). Исследования и разработка - rnd проекты.,,Более 6 лет,Полная занятость,https://hh.ru/vacancy/83922012,Programmer
913,Frontend Developer,,Алматы,Home Credit Bank,05-07-2023,Отличные знания JavaScript. Опыт работы с React/Angular. Понимание современного стека web-разработки. Готовность работать в распределенной команде. ,Разрабатывать клиентские и внутренние интерфейсы. Участвовать в командной разработке. Внедрять новые технологии и практики.,,От 3 до 6 лет,Полная занятость,https://hh.ru/vacancy/83039878,Programmer
914,Инженер-программист,500000 KZT,Алматы,Микрофинансовая организация Азиатский Кредитный Фонд,30-06-2023,Навыки администрирования баз данных MS SQL Server. Знание теории реляционных баз данных. Знание принципов проектирования и нормализации БД. ,Администрирование MS SQL сервер и разработка.,,От 3 до 6 лет,Полная занятость,https://hh.ru/vacancy/82841350,Programmer
915,Golang-разработчик,,Алматы,iBEC Systems,24-07-2023,"Честного, полного энтузиазма и лояльности к своей работе опытного Golang-разработчика. Чего мы ждём от вас: Опыт работы в качестве...",Внешние и внутренние семинары или доклады.,,От 1 года до 3 лет,Полная занятость,https://hh.ru/vacancy/82889185,Programmer
