,title,salary,city,job,publish_date,requirements,responsibilities,schedule,experience,employment,url,Job
1306,Frontend разработчик vue middle,,Астана,АДмастерс,27-06-2023,Новые знания и сильное окружение. Опыт коммерческой frontend разработки от 3-х лет. Знание современных стандартов и методов разработки веб...,"Поддерживать и развивать архитектуру проекта. Поднимать новый проект для переноса сайта на новые технологии (TypeScript, Vue3 +Vuetify) Разбирать старые...",,От 3 до 6 лет,Полная занятость,https://hh.ru/vacancy/82595727,Programmer
1307,Backend разработчик/Программист (strong junior / middle) Laravel,350000 - 700000 KZT,Алматы,Oktrening,21-07-2023,"Backend разработчик (Программист) Laravel strong junior or middle. Вы должны уверенно владеть PHP, laravel, vue.","3. Вам нужно будет попунктно выполнять задачи по разработки функционала, так же тестировать, выявлять баги и устранять их, достигая поставленных...",,От 3 до 6 лет,Полная занятость,https://hh.ru/vacancy/82935271,Programmer
1308,Senior Backend разработчик (ASP.Net Core),,Астана,ЧК CDS DEVELOPMENT LTD.,03-07-2023,"Опыт программирования на ASP.Net Core от 3 лет. Понимание принципов ООП. Умение разбираться в чужом код. Знание инструментов (Jira, Git). ",Разрабатывать Backend решения на ASP.Net Core (C#). Работа в команде разработчиков и тесное взаимодействие с аналитиками. Создание сложных и переиспользуемых...,,От 3 до 6 лет,Полная занятость,https://hh.ru/vacancy/82886894,Programmer
1309,"Fullstack разработчик (.Net, Angular)",420000 - 900000 KZT,Астана,РГП на ПХВ «Инженерный центр Управления материально-технического обеспечения»,05-07-2023,"Уверенные знания и опыт разработки на С# (ASP.Net Core, EF Core). Опыт работы с СУБД PostgreSQL и MS SQL. ","Поддержка, развитие, рефакторинг и покрытие тестами существующих систем. Проектирование и реализация новых систем в рамках бизнес-требований заказчика. ",,От 3 до 6 лет,Полная занятость,https://hh.ru/vacancy/82243691,Programmer
1310,Инженер-программист АСУ ТП,,Алматы,ЛОТТЕ Рахат,24-07-2023,"Высшее профессиональное (техническое) образование. Стаж работы не менее 3 лет. Умение работать с ПЛК Siemens S7-200, S7...","Организует и выполняет работы по установке, отладке, настройке, опытной проверке, корректировке и испытаниям, вводу в эксплуатацию, модернизации, технически правильной эксплуатации...",,От 3 до 6 лет,Полная занятость,https://hh.ru/vacancy/82886973,Programmer
1311,"Программист 1С (Учет планирования продаж, розницы и коммерции)",,Алматы,Sulpak,22-07-2023,"Знание ПО 1С 8x. Умение разбираться в чужом коде. Знание веб/http-сервисов, XML, JSON.",Разработка конфигураций под задачи заказчика. Ведение проектов. Поддержка и консультация пользователей.,,От 1 года до 3 лет,Полная занятость,https://hh.ru/vacancy/79074361,Programmer
1312,Lead Java Developer (Мобильный цифровой оператор),,Алматы,"Beeline, ТМ",19-07-2023,Высшее техническое образование(ИТ или математическое). Опыт работы в сфере разработки/администрирования IT-систем от 4-х лет. ,"Общее руководство командой back-end разработки; организация, планирование, контроль и модернизация процессов. Распределение задач и расстановка приоритетов по ним. ",,От 3 до 6 лет,Полная занятость,https://hh.ru/vacancy/83676226,Programmer
1313,Senior разработчик Colvir,,Алматы,Микрофинансовая организация KMF(КМФ),20-07-2023,Опыт работы от 2-х лет в банковской или коммуникационной сфере в части развития и поддержки АБИС Colvir. ,Принимать участие в работах по внедрению АБИС Colvir. Анализировать бизнес-требования для автоматизации банковских продуктов/процессов осуществляемых в АБИС. ,,От 1 года до 3 лет,Полная занятость,https://hh.ru/vacancy/83734443,Programmer
1314,Python Senior Developer,,Астана,InterPress - International House,21-07-2023,Знание Python на уровне Senior Python разработчика. Уверенное знание и умение применять веб-фреймворк Django. Знание и практический опыт работы...,Нужно будет заниматься построением архитектуры и поиском правильных решений. Основная задача: Программирование нового функционала для системы. Построение архитектуры. ,,От 3 до 6 лет,Полная занятость,https://hh.ru/vacancy/83786010,Programmer
1315,Разработчик PL SQL,,Алматы,NOMAD insurance,22-07-2023,"Высшее образование. Опыт разработки для Страховых и Брокерских компаний приветствуется. Начальный опыт внедрения, разработки, программирования комплекса программ на базе Oracle...",Консультация пользователей системы. - Решение возникающим проблем и ошибок в ИС. - Разработка нового функционала.,,От 3 до 6 лет,Полная занятость,https://hh.ru/vacancy/82975281,Programmer
1316,Программист 1С,,Астана,Диалог-Сервис,22-07-2023,Высшее образование. Опыт работы в сфере (программистом 1С) от 2-х лет и более. Навык программирования программ 1С. ,"Оценка работ (объём и стоимость). Разработка конфигураций на платформе 1С (разработка отчётов на СКД, разработка внешних обработок и печатных...",,От 1 года до 3 лет,Полная занятость,https://hh.ru/vacancy/83207218,Programmer
1317,Power BI Developer,,Астана,Itransition,11-07-2023,Bachelor's degree in Computer Science or equivalent IT degree. Background in data analysis in banking/finance/statistics/accounting etc. ,"Work with business and development teams to design, develop and deploy interactive data visualization using Microsoft Power BI. ",,От 1 года до 3 лет,Полная занятость,https://hh.ru/vacancy/76085103,Programmer
1318,Frontend Developer (Angular),500000 - 700000 KZT,Алматы,Коркем Телеком,04-07-2023,"Знать один из популярных JS-фреймворков Angular, а также библиотеку (React), SASS/SCSS/Less/PostCSS, понимать RESTful интерфейсы. ",Разработка интерфейса системы. Отработка тасков с техподдержкой. Устранение багов.,,От 3 до 6 лет,Полная занятость,https://hh.ru/vacancy/82978877,Programmer
1319,"Senior/Middle Full-stack Web developer / Web разработчик (MySQL, PHP(Laravel), Vue, Golang)",,Астана,DIMEDUS (Димедус),11-07-2023,"MySQL. PHP(Laravel). TypeScript (Vue,js). HTML, CSS (SCSS). Golang. Опыт работы с системами контроля версий (Git). Английский язык на...",Поддерживать текущие и создавать новые интерактивные web-проекты. Участвовать в исследованиях и отработке технологий и пайплайнов. Работать с популярными фреймворками.,,От 3 до 6 лет,Полная занятость,https://hh.ru/vacancy/83249313,Programmer
1320,Java-разработчик (middle/senior),,Астана,Плейтокс (Playtox),21-07-2023,Опыт программирования на Java от 3 лет. Знание SQL и принципов работы с БД. Понимание принципов ООП. Умение разбираться в...,"Проектирование инженерных решений. Выполнение изменений в коде и написание нового кода. Подготовка изменений к поставке в бой, обеспечение необходимого качества...",,От 3 до 6 лет,Полная занятость,https://hh.ru/vacancy/82536170,Programmer
1321,1С программист,,Актобе,Цифрал Актобе,01-07-2023,"Знание MS SQL Server, 1C-Предприятие 8.2, 8.3 (Бухгалтерия, Торговля, Кадры, Зарплата, Абонентская Служба). Опыт интеграции различных...","Сопровождение 1С-конфигураций ""Бухгалтерия"", ""Абонентская служба"", ""Склад"". Программирование в конфигурации 1С:Бухгалтерия. Доработка конфигураций 1С под нужды...",,Более 6 лет,Полная занятость,https://hh.ru/vacancy/82869877,Programmer
1322,Программист 1С (Senior),800000 KZT,Астана,Сеть магазинов цифровой и бытовой техники ДНС КАЗАХСТАН,17-07-2023,Опыт разработки на платформе 1С:Предприятие 8.x от 3-х лет. Знание принципов клиент-серверной архитектуры 1С. ,Разработка новых инструментов и доработка существующих в наших системах 1С. Проработка и оптимизация архитектуры и алгоритмов. Решение задач интеграции...,,От 3 до 6 лет,Полная занятость,https://hh.ru/vacancy/79855767,Programmer
1323,PHP Backend-разработчик,,Алматы,ALLUR AUTO,13-07-2023,"Опыт работы PHP, JavaScript и знанием веб-верстки. Знание передовых правил программирования и принципов разработки. Опыт работы с внешними API...","Разработка и поддержка back части платформы, мобильного приложения. Создание чистого, эффективного, тестируемого и многократно используемого кода. Участие в код-ревью...",,От 3 до 6 лет,Полная занятость,https://hh.ru/vacancy/81930690,Programmer
1324,Senior Python Developer,,Астана,Elilink,21-07-2023,"Commercial working experience with Python from 4+ years. Excellent knowledge of general programming issues: design patterns, data structures, algorithms. ","Write structured, clean, reusable, and testable code using Python. Design and implement robust application. Provide technical solutions. Translate client requirements...",,От 3 до 6 лет,Полная занятость,https://hh.ru/vacancy/83824660,Programmer
1325,Data Engineer (GoLang Developer),4000 EUR,Алматы,Wisebits,26-06-2023,Хорошие знания и опыт работы с Golang и ClickHouse. Опыт разработки от 3-х лет. Опыт работы с NoSql. ,"Выполнять эпизодические задачи на анализ данных. ETL, разработка сервисов сбора, хранения и доступа к статистике и данным. Оптимизация/создание pipeline...",,От 3 до 6 лет,Полная занятость,https://hh.ru/vacancy/82402844,Programmer
1326,Инженер-программист в среде LINUX/QNX,,Астана,DOCUMENTOLOG CREATIVE STUDIO,12-07-2023,Высшее техническое образование. Знание языка программирования С/С++. Опыт разработки ПО в Embedded Linux/QNX. Опыт работы с операционными системами...,Разработка ПО под Embedded Linux/QNX на базе Xilinx SoC Zynq. Разработка и отладка драйверов устройств для процессоров ARM под...,,От 3 до 6 лет,Полная занятость,https://hh.ru/vacancy/83312123,Programmer
1327,PHP-разработчик уровня Middle,400000 - 750000 KZT,Астана,Documentolog,21-07-2023,"Уверенное владение PHP/SQL и высокая культура разработки. - Знание ООП, шаблонов проектирования, базовых алгоритмов. - Опыт разработки в команде на любом...",Разработка нового функционала платформы Documentolog и других проектов компании. - Совместное с командой проектирование решений для реализации функционала. - Участие в разработке...,,От 1 года до 3 лет,Полная занятость,https://hh.ru/vacancy/82913982,Programmer
1328,Fullstack-разработчик в проектный отдел логистики,,Алматы,"Small, ТМ (Скиф Сауда, ТОО)",05-07-2023,"Опыт работы в области веб-разработки от 2-х лет. Углубленное знание Laravel, PHP и умение оптимизировать производительность приложений, включая...","Разработка, развитие, поддержание и доработка программных продуктов, используемых в логистике торговой сети. Сбор информации о возникающих проблемах, неудобствах, возможных улучшениях...",,От 3 до 6 лет,Полная занятость,https://hh.ru/vacancy/83006083,Programmer
1329,С++ разработчик,,Алматы,Prime Source,10-07-2023,Proven working experience as a senior C++ developer with modern C++ (11 or higher) Excellent knowledge of git and linux...,"We are looking for someone to develop new tools to scale up the software when deploying it, camera benchmark to...",,От 3 до 6 лет,Полная занятость,https://hh.ru/vacancy/83195704,Programmer
1330,Android Developer (Senior) в SuperApp,,Алматы,Kcell,01-07-2023,"Высшее образование. Опыт коммерческой разработки мобильных приложений от 2-х лет. Знание языков Java, Kotlin. Опыт работы с Kotlin Coroutines​. ","Создание сложных и переиспользуемых архитектурных решений. Техническое развитие проекта, исследование новых технологий и их интеграция. Проводить рефактор и своего, и...",,От 1 года до 3 лет,Полная занятость,https://hh.ru/vacancy/81388398,Programmer
1331,Middle Flutter разработчик,,Алматы,Codebase,29-06-2023,Знание фреймворка Flutter более года. Умение работать с git и Android studio. Знание концептов ООП и базовое понимание паттернов проектирования. ,Самостоятельно выполнять поставленные задачи на фреймворке Flutter. Писать новые компоненты. Поддерживать методологию TDD. Проходить code review.,,От 1 года до 3 лет,Полная занятость,https://hh.ru/vacancy/82281010,Programmer
1332,Разработчик Flutter Flow,400000 - 750000 KZT,Алматы,Хакимжанов А.Б,30-06-2023,"Опыт разработки на Flutter Flow. Опыт работы с REST api, базами данных. Опыт разработки мобильных приложений с нуля. ",Разработка мобильных приложений на базе iOS и Android под ключ.,,От 1 года до 3 лет,Полная занятость,https://hh.ru/vacancy/82840227,Programmer
1333,Senior Android developer,,Алматы,Freedom Technologies,13-07-2023,"Опыт разработки мобильных приложений. Участие в разработке коммерческих приложений, наличие завершенных проектов в Google Play. Знание и применение на практике...",Проектирование и разработка клиентской части под android. Разработка приложения с учетом потребностей Компании. Участие в автоматизации процессов разработки. ,,От 3 до 6 лет,Полная занятость,https://hh.ru/vacancy/83384342,Programmer
1334,PHP-разработчик,4000 - 5000 EUR,Астана,Онлайн решения Б2Б,21-07-2023,"3. Технологии и инструменты. - gitlab, docker, telegraf + grafana. - query, vue. - PHP 8.1, symfony + twig, mysql, redis, nginx. - ","Работа с лидами, верификация, финансы, интеграция с торговыми платформами (MT4, MT5, CTrader, DevXperts, XOpenHub и другие), отчеты, автоматизация...",,Более 6 лет,Полная занятость,https://hh.ru/vacancy/82558131,Programmer
1335,Программист 1С Бухгалтерия предприятия 3.0,500000 KZT,Астана,Сеть магазинов цифровой и бытовой техники ДНС КАЗАХСТАН,13-07-2023,"Опыт разработки на платформе 1С:Предприятие 8.x от 1,5 лет. Желание учиться и развиваться в роли технического...","Разработка новых инструментов и доработка существующих в информационной системе ""1С:Бухгалтерия предприятия 3.0"". Проработка и оптимизация архитектуры и...",,От 1 года до 3 лет,Полная занятость,https://hh.ru/vacancy/70830380,Programmer
1336,"Senior Backend Developer, удаленно (Laravel, РНР)",220000 - 360000 RUR,Астана,Obalor,23-07-2023,"Отличное знание Laravel 8+. Отличное владение PHP 7.4+, ООП, паттерны. Опыт использования GraphQL. Linux или OSX в...",Разработка нового полезного функционала. Разработка API и парсеров. Поддержка и оптимизация существующих модулей.,,Более 6 лет,Полная занятость,https://hh.ru/vacancy/82813911,Programmer
1337,"Middle/Senior Fullstack (PHP-Laravel, Vuejs) разработчик",300000 - 800000 KZT,Алматы,Partners Go,29-06-2023,"График работы: full time, office/remote. Стек: ⁃ Сервер: CentOS, nginx, php, MySQL. Необходимые профессиональные навыки:  будет плюсом опыт управления технической...","Front-end: HTML, CSS, JS, Vue.js.  поиск/найм специалистов и формирование “технической” команды.  бизнес-аналитика: изучение бизнес процессов, определение тех...",,От 3 до 6 лет,Полная занятость,https://hh.ru/vacancy/82800243,Programmer
1338,Senior .NET Developer,,Алматы,Новео,05-07-2023,Опыт разработки на .NET framework/.NET core с C# и ASP.NET от 3х лет. Высшее образование в области информационных...,,,От 3 до 6 лет,Полная занятость,https://hh.ru/vacancy/83036712,Programmer
1339,Full stack разработчик,,Астана,Sebekon,26-06-2023,Опыт работы с PHP фреймворками от 3 лет. Опыт работы с JavaScript и реактивными фреймворками (VueJS или ReactJS). ,"Разработка веб-приложений с микро сервисной и сервис-ориентированной архитектурой. Разработка RESTful Web Service, использование протоколов авторизации OAuth 2.0...",,От 3 до 6 лет,Полная занятость,https://hh.ru/vacancy/82380655,Programmer
1340,Программист 1C,,Астана,SmartFIS,21-07-2023,"Умение программировать как в обычных так и на управляемых формах. Опыт работы с СКД, разработки отчетов и обработок. ","Разработка новых объектов конфигурации, подсистем, внешних и встроенных печатных форм, отчеты и обработки. Работа с конфигурациями УТП, ЗУП, БК, Бухгалтерия...",,От 1 года до 3 лет,Полная занятость,https://hh.ru/vacancy/83786540,Programmer
1341,1С Разработчик,370000 - 420000 KZT,Алматы,"ProMebel, ТМ (ТОО IDIA Market)",24-07-2023,"Вас отличают такие качества как трудолюбие и целеустремленность. Вы учились с высокой успеваемостью. Техническое образование. Ответственность, умение работать в команде.","Обслуживание клиентских программ (конфигурация, кастомизация, upgrade клиентских программ под требования проекта). Автоматизация бизнеса. Установка и обучение программы 1С для...",,От 1 года до 3 лет,Полная занятость,https://hh.ru/vacancy/82899917,Programmer
1342,Senior frontend разработчик,,Алматы,Микрофинансовая организация KMF(КМФ),10-07-2023,"3-5 лет опыта работы в сфере веб-разработки, в том числе значительный опыт работы с HTML, CSS, JavaScript, и...",Разработка и сопровождение системы банковского приложения (личный кабинет для ФЛ/ИП/ЮЛ). Участие в процессах и общих вопросах по коммуникациям...,,От 3 до 6 лет,Полная занятость,https://hh.ru/vacancy/83221737,Programmer
1343,Программист 1C,500000 KZT,Алматы,Котофей Казахстан,05-07-2023,Уверенные знания синтаксиса и стандартов разработки конфигураций 1С. Опыт построения и поддержки обменов между различными информационными системами. ,"Участие в проекте по внедрению нового функционала в 1C Розница, УТ, ЗУП, БУХ. Доработка конфигураций под требования бизнеса. ",,От 3 до 6 лет,Полная занятость,https://hh.ru/vacancy/81865544,Programmer
