title,salary,city,job,publish_date,requirements,responsibilities,schedule,experience,employment,url
Графический и UI/UX Junior web-дизайнер,100000 KZT,Алматы,GoodViz,20-07-2023,"Любой опыт работы на аналогичной позиции. Знание и опыт работы с инструментами: Figma, Adobe Photoshop и Adobe Illustrator. ","Разработка и создание сайтов, включая дизайн и UX. Разработка и внедрение брендбуков и логобуков. Создание графических материалов для рекламы и...",,От 1 года до 3 лет,Полная занятость,https://hh.ru/vacancy/83780079
UX/UI дизайнер (Удаленно),,Алматы,NCRM GROUP,23-07-2023,Свободное владение Figma. Владение основами типографики и композиции. Способность к генерации и визуализации интерфейсных решений. Понимание принципов usability и адаптивности...,Работать над внутренними проектами по веб направлению и мобильной разработке. Развивать дизайн-систему. Взаимодействовать с разработчиками и сопровождать процесс реализации...,,От 1 года до 3 лет,Проектная работа,https://hh.ru/vacancy/83901897
UX/UI Дизайнер,150000 - 200000 KZT,Актобе,eDauir,19-07-2023,Быстрая обучаемость и желание развиваться.,"Работа в Актобе. Разработка UI/UX дизайна сайта, платформы.",,От 1 года до 3 лет,Полная занятость,https://hh.ru/vacancy/83703079
UI/UX Веб-дизайнер,300000 - 500000 KZT,Алматы,Keip Tech,23-07-2023,"Опыт работы в области UI/UX дизайна от 3 лет. Владение инструментами Figma, включая создание и использование динамических компонентов, прототипирование...","Разработка и реализация дизайна пользовательского интерфейса веб-приложений. Проведение исследований пользовательского опыта, внедрение полученных знаний в дизайн. Работа над улучшением...",,От 3 до 6 лет,Полная занятость,https://hh.ru/vacancy/83539016
UX-UI дизайнер мобильного приложения,,Астана,Locagroup,18-07-2023,"Опыт работы в области графического дизайна и UI/UX дизайна. Уверенное владение инструментами дизайна, такими как Adobe Creative Suite (Photoshop...","Разработка пользовательских интерфейсов (UI) мобильных приложений и других цифровых продуктов, с учетом современных трендов и лучших практик UX/UI дизайна. ",,От 1 года до 3 лет,Полная занятость,https://hh.ru/vacancy/83632017
UX/UI дизайнер,,Алматы,Golden Bridge Partners,22-07-2023,"Опыт работы UX/<highlighttext>UI</highlighttext> <highlighttext>дизайнером</highlighttext> с реализованными проектами (сложные интерфейсы взаимодействия web/mobile будет плюсом). Умение доносить идею, отстаивать свою...",Adobe Photoshop. Adobe Illustrator. Figma. Usability. Графический дизайн. Проектирование пользовательских интерфейсов. Дизайн интерфейсов. Web-дизайн. UX/UI.,,От 1 года до 3 лет,Полная занятость,https://hh.ru/vacancy/83675607
UX/UI-дизайнер,,Астана,Апару,05-07-2023,,"Разработка интерфейсов, которые превосходят все ожидания пользователей. До встречи!",,От 1 года до 3 лет,Полная занятость,https://hh.ru/vacancy/83007226
UX/UI Дизайнер,350000 - 500000 KZT,Алматы,ТРАНСЛАЙН,24-07-2023,"Портфолио. Опыт от 1-го года. Figma, Photoshop. Понимание работы Front-End части. Будет плюсом: Профильное образование в части дизайна...",Разработка макетов на Figma. Улучшение user experience от наших услуг. Разработка дизайн кода. Создание UI Kit. Обсуждение юзабилити сайта и...,,От 1 года до 3 лет,Полная занятость,https://hh.ru/vacancy/83935220
UX/UI designer,,Алматы,Международная беттинг компания Parimatch (ТОО БК PM Бет),24-07-2023,Релевантный коммерческий опыт от 2-х лет. Свободное владение Figma. Знание принципов Usability. Реальный опыт разработки адаптивного дизайна. ,Дизайн сайтов под различные проекты компании. Дизайн промо-лендингов. Разработка дизайна пользовательских интерфейсов в соответствии с дизайн-системой для продукта...,,От 1 года до 3 лет,Полная занятость,https://hh.ru/vacancy/83616464
UI/UX Дизайнер,,Алматы,IDOCSKZ,12-07-2023,Уверенное владение Figma. Опыт работы в команде с разработчиками. Опыт в дизайне мобильных приложений. Знания в Google material и Apple...,"Отвечать за пользовательский интерфейс и его архитектуру. Взаимодействие, исследования пользователей и визуальный дизайн на разных платформах. Определение целевой аудитории продукта...",,От 1 года до 3 лет,Полная занятость,https://hh.ru/vacancy/83334148
UI/UX desıgner,,Астана,АДмастерс,19-07-2023,"Опыт проектирования мобильных приложений и сайтов. - Уверенное использование Figma. - Понимание концепции Pixel Perfect, основ HTML / CSS. - Знание гайдлайнов iOS и...",Экосистема TrustMe находится в поиске Frontend-разработчика. - Анализ целевой аудитории платформы и мобильного приложения. - Выработка рекомендаций к UX на основании...,,От 3 до 6 лет,Полная занятость,https://hh.ru/vacancy/83659598
Дизайнер UI/UX,,Алматы,"Bank RBK, АО",30-06-2023,"Понимание принципов UI/UX. Опыт работы не менее 1 года в должности дизайнера UI/UX с портфолио, демонстрирующим реализованные проекты. ","Разработка концепций UI/UX в соответствии с бизнес-требованиями. Дизайн и планирование разделов, функций и отдельных экранов для приложений и...",,От 3 до 6 лет,Полная занятость,https://hh.ru/vacancy/82821055
Ux/ui дизайнер,300000 KZT,Алматы,PAYDA Accounting Development (ПАЙДА Аккаунтинг Девелопмент),24-07-2023,Опыт проектирования мобильных приложений и сайтов. Уверенное использование Figma. Знание гайдлайнов iOS и Android. Понимание принципов адаптивного дизайна. ,Анализ целевой аудитории платформы и мобильного приложения. Выработка рекомендаций к UX на основании построенных CJM c последующей доработкой. ,,От 1 года до 3 лет,Полная занятость,https://hh.ru/vacancy/83312622
UX/UI Designer в SuperApp,,Алматы,Kcell,01-07-2023,Высшее образование. Знание принципов веб-дизайна и гайдлайнов для Apple и Google. Уверенное владение инструментами Figma / Sketch. Прототипирование и использование...,"Тесно работать вместе с разработчиками и Product Owner-ами. Создавать решения для сложных пользовательских сценариев, продумывать состояния. Отстаивать интересы пользователя...",,От 1 года до 3 лет,Полная занятость,https://hh.ru/vacancy/81388274
UI/UX Дизайнер,300000 - 500000 KZT,Алматы,Зина Групп,24-07-2023,Исследование опыта пользователя на основе данных аналитики или данных фокус групп. Обладаешь твердыми знаниями лучших практик UX и системным мышлением. ,"Создания концептов дизайна, и участие в создании процессов использования продукта пользователями. Составлять и документировать guidelines на UI/UX для команд...",,От 1 года до 3 лет,Полная занятость,https://hh.ru/vacancy/82511718
Дизайнер UI/UX (Middle/Senior),,Алматы,Банк ЦентрКредит,11-07-2023,Опыт работы UX/<highlighttext>UI</highlighttext> <highlighttext>дизайнером</highlighttext> в продуктовой команде с реализованными проектами (сложные интерфейсы взаимодействия web/mobile будет плюсом). ,Проектировать опыт взаимодействия пользователей с продуктами и процессами в наших цифровых каналах. Проверять и улучшать дизайн-решения на основе пользовательских...,,От 3 до 6 лет,Полная занятость,https://hh.ru/vacancy/83290935
UI/UX Designer (remote),,Алматы,Zoftify Eesti OÜ,27-06-2023,"Experience leading in product design workshops. Experience designing products from A to Z (product <highlighttext>design</highlighttext>, wireframing, prototyping, <highlighttext>UI</highlighttext>).","Work on international projects (Germany, Switzerland, UK, US). Design beautiful mobile and web apps in Figma. Participate in product design...",,От 3 до 6 лет,Полная занятость,https://hh.ru/vacancy/82558053
Дизайнер UI/UX (веб-сайт и мобильные приложения),,Алматы,ALLUR AUTO,20-07-2023,"Инструменты дизайна: Уверенное владение инструментами дизайна, такими как Sketch, Adobe XD, Figma или аналогичными. Прототипирование: Опыт работы с инструментами прототипирования...",Определение пользовательских требований и целей: Сбор и анализ пользовательских требований и определение ключевых метрик успеха. Создание концепций и прототипов: Разработка...,,От 3 до 6 лет,Полная занятость,https://hh.ru/vacancy/82190545
Senior/Team Lead UX/UI дизайнер,,Алматы,Airba Fresh,13-07-2023,"Опыт работы в UX/UI дизайне не менее 3 лет, включая опыт работы в роли лидера команды. Опыт работы в...","Руководство командой UX/<highlighttext>UI</highlighttext> <highlighttext>дизайнеров</highlighttext>, включая постановку целей, распределение задач и обеспечение выполнения проектов в срок. Разработка пользовательских интерфейсов мобильных...",,От 3 до 6 лет,Полная занятость,https://hh.ru/vacancy/83383546
UI/UX дизайнер,,Алматы,Fntastic» (Фнтастик),22-07-2023,Применять творческое и креативное мышление для решения нестандартных задач.  Наличие актуального портфолио с примерами работ.  Уверенное владение графическими редакторами Adobe...,Fntastic — международная организация со штаб-квартирой в Сингапуре.  Создавать дизайны многофункциональных пользовательских интерфейсов для игровых проектов.  Сопровождать интеграцию созданных пользовательских...,,От 1 года до 3 лет,Полная занятость,https://hh.ru/vacancy/83189131
UI/UX дизайнер,,Астана,Fntastic» (Фнтастик),22-07-2023,Применять творческое и креативное мышление для решения нестандартных задач.  Наличие актуального портфолио с примерами работ.  Уверенное владение графическими редакторами Adobe...,Fntastic — международная организация со штаб-квартирой в Сингапуре.  Создавать дизайны многофункциональных пользовательских интерфейсов для игровых проектов.  Сопровождать интеграцию созданных пользовательских...,,От 1 года до 3 лет,Полная занятость,https://hh.ru/vacancy/83189132
Преподаватель курса UI/UX дизайн,120000 - 360000 KZT,Астана,MyFreedom Education,18-07-2023,"Знание Figma, Photoshop. Грамотная речь. Умение работать в команде. Умение общаться и объяснять.",Преподавание по готовой методике. Проверка домашних заданий. Составление отчетов о посещаемости и успеваемости студентов.,,От 3 до 6 лет,Частичная занятость,https://hh.ru/vacancy/83590063
Web UI/UX Designer,,Астана,G5EN KAZ,22-07-2023,"Опыт разработки интерфейсов для веб-сайтов или приложений от 2-х лет. Знание общих принципов UI/UX, основ композиции и...","Дизайн интерфейсов для веб-сайтов и веб-приложений. Работа в тесном контакте с менеджерами по продукту, разработчиками и тестировщиками. ",,От 3 до 6 лет,Полная занятость,https://hh.ru/vacancy/83675914
3D Designer with UX/UI Experience,,Астана,Ramotion,27-06-2023,"The opportunity to collaborate with innovative startups and fast-growing SMBs in sectors like SAAS, Fintech, Edtech, Healthcare, Green Energy...","A stable stream of diverse projects in various formats, including AR/VR, mobile apps, and web apps. Clear and structured...",,От 3 до 6 лет,Полная занятость,https://hh.ru/vacancy/82572021
"UX/UI product дизайнер (Senior, Fintech)",,Алматы,Финансовые Платформы,22-07-2023,Опыт работы на должности UI/UX-проектировщика с аналогичными функциями от 5 лет в финтех-проектах (обязательно). Английский язык C...,Исследование задач и предметной области. Сбор и анализ требований к новому и существующему функционалу. Проработка пользовательских сценариев. Разработка макетов дизайна...,,Более 6 лет,Полная занятость,https://hh.ru/vacancy/82685447
UI Director,,Алматы,G5EN KAZ,22-07-2023,"Портфолио реализованных проектов. Опыт управления отделом/командой <highlighttext>UI</highlighttext>-<highlighttext>дизайнеров</highlighttext>. Эффективные коммуникативные и организаторские способности. Сильный визуализатор, способный преобразовывать игровой дизайн...",Ответственность за создание и внедрение пользовательского интерфейса в проекты компании. Обучение <highlighttext>UI</highlighttext>-<highlighttext>дизайнеров</highlighttext> принципам юзабилити и дизайна интерфейсов. ,,От 3 до 6 лет,Полная занятость,https://hh.ru/vacancy/82976209
Middle UI Artist,,Астана,Playrix,13-07-2023,Опыт создания интерфейсов для мобильных игр от двух лет (преимущественно в казуальной стилистике). Портфолио с примерами работ по UI. ,Поиск интересных и уникальных интерфейсных решений для новых фич. Отрисовка сложных окон и всех их элементов. Взаимодействие с другими участниками...,,От 1 года до 3 лет,Полная занятость,https://hh.ru/vacancy/81890352
UI Director,,Астана,G5EN KAZ,22-07-2023,"Портфолио реализованных проектов. Опыт управления отделом/командой <highlighttext>UI</highlighttext>-<highlighttext>дизайнеров</highlighttext>. Эффективные коммуникативные и организаторские способности. Сильный визуализатор, способный преобразовывать игровой дизайн...",Ответственность за создание и внедрение пользовательского интерфейса в проекты компании. Обучение <highlighttext>UI</highlighttext>-<highlighttext>дизайнеров</highlighttext> принципам юзабилити и дизайна интерфейсов. ,,От 3 до 6 лет,Полная занятость,https://hh.ru/vacancy/82976208
