title,salary,city,job,publish_date,requirements,responsibilities,schedule,experience,employment,url
Менеджер по продажам IT продуктов,,Астана,TargetAI Limited,19-07-2023,2+ лет опыта в IT сфере. Высокие коммуникативные навыки. Работа с воронкой продаж и ведением лидов. Английский не ниже...,"Участие в работе pre-sales team, ведение коммерческих переговоров с текущими и потенциальными клиентами. Развитие бизнеса с клиентами B2...",,От 3 до 6 лет,Полная занятость,https://hh.ru/vacancy/83697544
IT методолог,,Алматы,Жилищный строительный сберегательный банк Отбасы банк,17-07-2023,"Высшее образование. Опыт работы от 3 лет. Знание основ управления ИТ-услугами (ITIL, Cobit и т.д). Навыки деловой переписки. ","Разработка внутренних нормативных документов. Улучшение качества предоставления ИТ-услуг. Внедрение, оценка зрелости, оптимизация процессов управления ИТ-услугами. Развитие ITSM системы. ",,От 1 года до 3 лет,Полная занятость,https://hh.ru/vacancy/81440234
Специалист по IT,150000 - 180000 KZT,Астана,IT-SOLUTION (АЙ ТИ-СОЛЮШН),20-07-2023,Практический опыт работы в сфере IT свыше 2х лет. Знание построения сетей интернета. Знание программной и аппаратной части ПК...,"Настройка, диагностика, модернизация, ремонт компьютеров, ноутбуков, принтеров и т.п. Установка, настройка, оптимизация ОС Windows 7,8,10. ",,От 1 года до 3 лет,Полная занятость,https://hh.ru/vacancy/83729927
1С IT-специалист,100000 - 300000 KZT,Алматы,IT DOC,12-07-2023,"Техническое образование в области информационных технологий. Аккуратность, дисциплинированность, коммуникабельность, усидчивость. Наличие сертификата «1С» приветствуется.",Установка/настройка бухгалтерских программ. Настройка типовых отчетов. Обработка данных в 1С. Добавление пользователей в 1С и настройка прав. ,,От 1 года до 3 лет,Полная занятость,https://hh.ru/vacancy/83347017
Главный IT-специалист,,Алматы,ОФ АРМАН АЙМАҒЫ,23-07-2023,"Работать со скриптовыми языками программирования Perl, Python, VB script. Навыки работы с программами автоматического тестирования WinRunner, VisualTest, Silk, RationalTestStudio, e...","Обеспечивать бесперебойное функционирование Интернет, почтового и других серверов, рабочих станций пользователей компании. Обеспечивать бесперебойную и безошибочную работу операционных систем и...",,От 1 года до 3 лет,Полная занятость,https://hh.ru/vacancy/83290783
IT analytic,,Алматы,АНКОР Центральная Азия,12-07-2023,"Высшее образование в сфере информационных технологий, высшее техническое образование. - Опыт работы 4-8 лет в сфере информационных служб, информационных технологий. - ","Эффективно выполнять обязанности <highlighttext>специалиста</highlighttext> в терминах дисциплин управления информационными технологиями, выполнять обязанности координатора изменений. Координировать внедрение изменений и работать с...",,От 3 до 6 лет,Полная занятость,https://hh.ru/vacancy/83327171
Специалист отдела закупок IT оборудования и ПО,200000 - 400000 KZT,Алматы,Inova Tech,22-07-2023,"Опыт работы закупщиком от 1 года. Умения и навыки: способность к анализу, планированию и управлению и организация сбора информационной базы...",Работа с продакт\категорийными менеджерами дистрибьюторов. Поиск товара согласно запросу и изучению его специфики. Формировать заказы и осуществлять контроль над...,,От 1 года до 3 лет,Полная занятость,https://hh.ru/vacancy/83222974
"Старший менеджер по IT-инфраструктуре (серверы, массивы хранения данных, инфраструктура датацентров)",,Астана,Nazarbayev University,15-07-2023,"Образование: Высшее профессиональное, желательно в высших учебных заведениях с преподаванием на английском языке, степень не ниже Бакалавр/<highlighttext>Специалист</highlighttext>. ","1) участвует в разработке новых стратегий и процедур Подразделения в целях повышения эффективности, совершенствования рабочих процессов и степени удовлетворенности пользователей...",,От 3 до 6 лет,Полная занятость,https://hh.ru/vacancy/80469821
Специалист по продажам IT продукта,150000 - 500000 KZT,Астана,АДмастерс,18-07-2023,умеете работать с возражениями клиента. -умеете работать в CRM системе. - у вас есть желание работать и развиваться в IT компании. -,"Умеете вести переговоры и находить боль клиента и закрывать её с помощью нашего продукта. Предстоит делать: -Продавать наш продукт, обработка...",,От 1 года до 3 лет,Полная занятость,https://hh.ru/vacancy/83607496
Ведущий менеджер по продажам IT-решений,,Алматы,ITGLOBAL.COM,04-07-2023,Опыт холодных звонков и готовность к активному поиску проектов. Опыт в продажах IT-оборудования/ IT-сервисов или образование в сфере...,"Активный поиск и привлечение новых корпоративных клиентов. Проведение встреч на уровне первых лиц компаний. Продажа IT-оборудования (сервера, СХД) и...",,От 1 года до 3 лет,Полная занятость,https://hh.ru/vacancy/82972275
IT-специалист,180000 KZT,Алматы,Коллекторское агентство Кредит Коллекшн Груп,23-07-2023,"Профильное образование. - Опыт установки и обслуживания компьютерных систем и оргтехники. - Опыт настройки программного обеспечения. - Логическое мышление, способность самостоятельно принимать решения. - ",Администрирование сетевого оборудования. - Техническая поддержка пользователей. - Обеспечение бесперебойной работы ИТ инфраструктуры офиса. - Установка нового оборудования и программного обеспечения. - ,,От 3 до 6 лет,Полная занятость,https://hh.ru/vacancy/83031208
Senior IT infrastructure consultant / Technology Consulting Group (Almaty/Astana ),,Алматы,KPMG,05-07-2023,"Completed relevant Bachelor/ Master degree in IT, Computer Science, Telecommunications. Minimum 3+ years of relevant work experience. ",Participate in IT infrastructure assessment projects. Perform IT audit. Perform internal risk-procedures. Improve IT infrastructure stream in Technology group. ,,От 3 до 6 лет,Полная занятость,https://hh.ru/vacancy/52581744
Специалист по IT,,Аксай (Казахстан),Ренко-КАТ,22-07-2023,Образование по специальности. Знание основ по ИТ.,Автоматизация процессов и поддержка существующих систем аналитики. Работа в основных программах системы Мiсгоsоft. Сервисное обслуживание аппаратного и программного обеспечения. ,,От 1 года до 3 лет,Полная занятость,https://hh.ru/vacancy/83238223
Менеджер по продажам B2B услуг (рекрутинговое IT-агентство Star-Staff),60000 - 120000 RUR,Алматы,Star-Staff,19-07-2023,Опыт работы в сфере B2B продаж (консалтинговые услуги). Желание развиваться в сфере IT технологий. Опыт работы в CRM...,"Продажи наших услуг для различных компаний, в том числе англоговорящих, по подбору IT-<highlighttext>специалистов</highlighttext>. Взаимодействие с командой рекрутеров.",,От 1 года до 3 лет,Полная занятость,https://hh.ru/vacancy/83708082
Менеджер по продажам B2B (IT услуг и ПО),,Алматы,Alcor,23-07-2023,"Опыт проектных продаж, прямых продаж в сфере ИТ\телеком от 2-х лет. Сильные коммуникативные навыки, умение общаться на равных...","Прямой поиск заказчиков, также работа с действующими клиентами - проработка входящих лидов. Консультация заказчиков по вопросам лицензирования программного обеспечения и функциональным...",,От 1 года до 3 лет,Полная занятость,https://hh.ru/vacancy/83754434
Менеджер по продажам B2b (IT-сфера),50000 - 250000 RUR,Астана,Демиденок Алексей Максимович,23-07-2023,"Наличие эффективного нетворкинга. Навыки проведения онлайн-встреч, переговоров, продаж. Наличие ноутбука, гарнитуры, стабильного доступа в интернет и знание основных офисных...","Поиск клиентов B2b, с нас все необходимые инструменты. Первое касание в продажах B2b (воочию, телефон, почта...",,От 1 года до 3 лет,Полная занятость,https://hh.ru/vacancy/83727786
Тренер по продуктовому обучению и техникам продаж (IT-продукты),,Алматы,Договор24,24-07-2023,"Высшее образование. Знание процесса продаж IT-продуктов, желателен опыт работы продакт/прожект-менеджером IT-продуктов. Дополнительное образование в тренинговой сфере...",Офлайн и онлайн презентаций по IT-продуктам компании. Учебных курсов по продуктам компании и техникам продаж. Материалов по продуктам и...,,Нет опыта,Проектная работа,https://hh.ru/vacancy/82893835
Менеджер по продажам B2B/ Менеджер по IT продажам,100000 - 1000000 KZT,Алматы,Кипер.KZ,21-07-2023,Готов обучатся или поделится полезными знаниями (мы всегда открыты новому). Командный игрок. 10 лет на рынке Казахстана.,"Телефонные переговоры, проведение встреч, составление коммерческих предложений, Согласование плана действия по клиентам с техническими <highlighttext>специалистами</highlighttext>; заключение договоров. Выполнение ежемесячного плана...",,От 1 года до 3 лет,Полная занятость,https://hh.ru/vacancy/83634349
