title,salary,city,job,publish_date,requirements,responsibilities,schedule,experience,employment,url
Специалист по IT (IT specialist),,Уральск,NOVATEQ-GROUP,21-07-2023,"Опыт работы в серьезных компаниях с локальной сетью, сервером, облачным хранилищем, лицензируемым ПО, CRM, 1С и т.д. ","Обслуживание ПК и офисной техники, замена комплектующих. Установка, настройка различного программного обеспечения. Ответственность за информационную безопасность в компании. ",,От 3 до 6 лет,Полная занятость,https://hh.ru/vacancy/83792434
Специалист по IT,450000 KZT,Алматы,Estate Management Company,20-07-2023,Высшее образование. Опыт установки и обслуживания компьютерных систем. Способность самостоятельно принимать решения. Высокая работоспособность.,Выявление потребности структурных подразделений в ИТ-услугах. Консультационная поддержка пользователей ИТ-услуг по вопросам работы информационных систем. Оперативное решение инцидентов...,,От 3 до 6 лет,Полная занятость,https://hh.ru/vacancy/83761893
Специалист по информационным технологиям (IT),400000 - 450000 KZT,Алматы,DBA UrAsia Energy Holdings Ltd – Kazakhstan Branch,18-07-2023,"Высшее техническое образование. Знание основных принципов построения сетей передачи данных. Опыт работы с серверным оборудованием. Быстрая обучаемость, ответственность, пунктуальность, исполнительность. ","Консультирование по техническим вопросам. Работа с техническими <highlighttext>специалистами</highlighttext> производителей. Поддержка и развитие информационной платформы. Решение проблем пользователей, оказание помощи. ",,От 1 года до 3 лет,Полная занятость,https://hh.ru/vacancy/83589248
Специалист IT отдела,400000 - 450000 KZT,Алматы,"Home Mart (EurasiaRed, ТМ)",22-07-2023,"Высшее техническое образование. Опыт работы в сфере IT, наличие навыков менеджера. Знание английского языка приветствуется. Знание основных принципов построения сетей...",Консультирование по техническим вопросам. Работа с техническими <highlighttext>специалистами</highlighttext> производителей. Поддержка и развитие информационной платформы. Мониторинг и анализ рынка и особенностей...,,Нет опыта,Полная занятость,https://hh.ru/vacancy/83387677
Технический специалист (IT),200000 - 300000 KZT,Алматы,Sulpak,29-06-2023,Образование или опыт работы в сфере IT. Желание работать с людьми. Желание учиться новому.,"Установка программного обеспечения. Кассовые операции. Настройка цифровой техники. Оформление доставки и установки товара. Оформление возврата, обмена товара. Выдача интернет-заказов. ",,От 1 года до 3 лет,Полная занятость,https://hh.ru/vacancy/82722181
IT-специалист / Помощник системного администратора,120000 - 140000 KZT,Алматы,ЮНИКС,18-07-2023,"Основные требования - это желание работать, получать опыт и знания и умение гуглить.","Начальный уровень. Осуществление решений инцидентов и проблем, возникающих в процессе работы информационных систем. Восстановление работоспособности информационных систем в случае сбоя...",,Нет опыта,Полная занятость,https://hh.ru/vacancy/83593170
CRM administrator/IT специалист,250000 KZT,Актобе,LONDON-EC,21-07-2023,"E ще и эмоциональный, позитивный и умеешь располагать к себе людей и убеждать. L юбишь жизнь, и знаешь, что тебе...",,,От 1 года до 3 лет,Полная занятость,https://hh.ru/vacancy/83806293
Специалист по IT,320000 - 320000 KZT,Караганда,Альянс Уголь,24-07-2023,"2.6. Разрешает или ограничивает доступ к информации, определяет порядок и условия такого доступа. Обязательно с опытом работы, высшее образование. ","2.1. Обеспечивает достоверность, защиту информации и своевременность ее предоставления. 2.2. Осуществляет установку, настройку, техническое сопровождение и обслуживание оборудования...",,От 1 года до 3 лет,Полная занятость,https://hh.ru/vacancy/83908163
IT Specialist,450000 - 600000 KZT,Алматы,KT&G GLOBAL KAZAKHSTAN (КЕЙ-ТИ-ЭНД-ДЖИ ГЛОБАЛ КАЗАХСТАН),19-07-2023,"1. Data Management capabilities. - Data analysis capabilities using SQL, Excel, etc. - Master Data control capability, (Dimension, measure, analytic information generation...","Management capabilities such as preventing leakage of company core information- Security system management and improvement (Policy, Process, System). - ",,От 1 года до 3 лет,Полная занятость,https://hh.ru/vacancy/83659539
Специалист по IT,250000 - 500000 KZT,Астана,TapTatti Retail,13-07-2023,"Умение установки операционные системы. Знание программы IIKO. Настройка и администрирование программу ""1C Предприятие"". Умение прикладного программирования. Пунктуальность.","Поддержание работоспособности офисных компьютеров. Администрирование и настройка 1С 8.2, 8.3. Поддержка пользователей. Установка и настройка прикладных программ. ",,От 1 года до 3 лет,Полная занятость,https://hh.ru/vacancy/81385728
Специалист по IT обслуживанию пользователей Офиса,,Астана,Nazarbayev University,17-07-2023,"Образование: высшее профессиональное, желательно в высших учебных заведениях с преподаванием на английском языке: Приоритетные направления специальностей: - компьютерные науки или смежные...",<highlighttext>Специалист</highlighttext> по IT обслуживанию пользователей Офиса по IT обслуживанию пользователей Информационных. Работа с аудиовизуальным и интерактивным оборудованием. Установка и проведение...,,Нет опыта,Полная занятость,https://hh.ru/vacancy/83520099
Специалист по IT,80000 - 150000 KZT,Петропавловск,КГУ ГОРОДСКАЯ КЛАССИЧЕСКАЯ ГИМНАЗИЯ ИМЕНИ САФУАНА ШАЙМЕРДЕНОВА КГУ ОТДЕЛ ОБРА-Я ГОРОДА ПЕТРОПАВЛОВСКА КГУ УПРАВ ОБРА-Я АКИМАТА СЕВ. КАЗ.ОБЛ,19-07-2023,Знание MS Office. Установка windows и работа с сайтами. - порядочный.,Ремонт компьютеров. Работа с компьютером.,,Нет опыта,Полная занятость,https://hh.ru/vacancy/83685994
Начинающий IT специалист в сфере 1С,150000 KZT,Астана,ИТС-ком,23-07-2023,Техническое образование - обязательно. Базовые знания в IT. Опыт работы с техникой. Грамотная речь. Готовность работать с Клиентами. Готовность много учиться...,"Установка, настройка программного обеспечения. Устранение проблем с ПО и оборудованием. Участие в сопровождении и внедрении продуктов. Оказание технической помощи действующим...",,Нет опыта,Полная занятость,https://hh.ru/vacancy/83523537
IT-специалист,200000 - 250000 KZT,Астана,PROTS,24-07-2023,Отличное знание компьютерной техники на программном и физическом уровне. Грамотная устная и письменная речь. Умение быстро вникать в суть и...,"Работа в ИС Трекере 100%. Умение разобрать ПК, Монблок, Ноутбук. Понимание принципа видеонаблюдения, видеорегистратора. Снять жесткий диск, материнскую плату, Оперативную...",,От 1 года до 3 лет,Полная занятость,https://hh.ru/vacancy/83932755
IT специалист/системный администратор,,Алматы,RAMS QAZAQSTAN,19-07-2023,"Высшее техническое образование. Опыт работы в аналогичной должности от 1 года. Общие знания программных продуктов Microsoft Office 365, Windows 7...","Прием, регистрация и классификация обращений от сотрудников компании по их обращениям в ИТ отдел. Предоставление доступов сотрудникам компании к внутренней...",,От 1 года до 3 лет,Полная занятость,https://hh.ru/vacancy/83683006
Специалист по IT (Системный администратор),80000 - 100000 KZT,Алматы,Help Desk Service,11-07-2023,Знание сетевых технологий. Базовые знания ПК и программ устанавливаемых на ПК. Желание решать проблемы пользовательского уровня. Если у Вас нет...,Устранение проблем на стороне пользователей. - Настройка и работа с сервером. - Удаленная поддержка клиентов. - Настройка локальных сетей и периферии. - ,,Нет опыта,Полная занятость,https://hh.ru/vacancy/83277476
Специалист по IT,200000 - 250000 KZT,Астана,IT Srvice@,17-07-2023,"Видеонаблюдение IP/Analog. ЛВС , маршрутизация интернета, знание топологии сети.. Требования: - Желание получить хороший опыт и стать <highlighttext>специалистом</highlighttext>. - Обучаемость.",Выполнение заявок по городу (большое количество филиалов). - Выполнение заявок через удаленный доступ в офисе. - Техническая поддержка и обслуживание.,,От 3 до 6 лет,Полная занятость,https://hh.ru/vacancy/83517717
IT-специалист,280000 - 300000 KZT,Алматы,GAB Construction,17-07-2023,"Навыки, знания и задачи системного администратора. Умение работать с веб-серверами (Apache, Ngninx, IIS). Понимание модели OSI. Знание операционных систем...","Обслуживание компьютерной, офисной и оргтехники: Ремонт используемой техники. Обеспечение бесперебойной работы всех ПК и устранение неисправностей. Помощь штатным сотрудникам, работающим...",,От 1 года до 3 лет,Полная занятость,https://hh.ru/vacancy/83528007
Специалист по IT,400000 - 450000 KZT,Алматы,FOOD BEVERAGE TRADING,22-07-2023,"Высшее техническое образование. Опыт работы в сфере IT, наличие навыков менеджера. Знание английского языка приветствуется. Знание основных принципов построения сетей...",Консультирование по техническим вопросам. Работа с техническими <highlighttext>специалистами</highlighttext> производителей. Поддержка и развитие информационной платформы. Мониторинг и анализ рынка и особенностей...,,От 3 до 6 лет,Полная занятость,https://hh.ru/vacancy/83193401
Специалист по IT,250000 - 400000 KZT,Алматы,Мыслинская,13-07-2023,"Знание аппаратной части ПК, сетевого оборудования. Навыки самообучения, ответственность, умение работать в команде. Наличие собственного автотранспорта.","Обеспечение бесперебойной работы компьютерной и оргтехники клиентов. Информационно-техническая поддержка клиентов. Установка/настройка ПО, драйверов. Установка и настройка ПО для...",,От 3 до 6 лет,Полная занятость,https://hh.ru/vacancy/81413658
IT-специалист,,Алматы,Sports Entertainment,19-07-2023,"Знание приложений Microsoft. Требования: Опыт установки и обслуживания компьютерных систем. Опыт настройки программного обеспечения. Логическое мышление, способность самостоятельно принимать решения. ","Техническая поддержка пользователей. Обеспечение бесперебойной работы ИТ инфраструктуры офиса. Установка нового оборудования и программного обеспечения. Мониторинг работы серверов, поддержка бесперебойной...",,От 1 года до 3 лет,Полная занятость,https://hh.ru/vacancy/83657145
Специалист по IT,300000 - 500000 KZT,Алматы,ПТО КазОхотРыболовСоюз,12-07-2023,"Совершенное знание word excel. Работа с word excel. На должность IT-<highlighttext>специалиста</highlighttext> принимается лицо, имеющее высшее профессиональное (математическое, инженерно-математическое...",,,От 3 до 6 лет,Полная занятость,https://hh.ru/vacancy/83315058
Специалист по IT,,Астана,"Назарбаев интеллектуальные школы, Автономная организация образования",17-07-2023,Наличие высшего образования в области информационных технологий. Наличие опыта работы по специальности не менее 2 лет. Наличие опыта работы в...,Техническая поддержка работоспособности IT инфраструктуры и пользователей (helpdesk). Внедрение и сопровождение программного обеспечения . Участие в составлении технических заданий. ,,От 1 года до 3 лет,Полная занятость,https://hh.ru/vacancy/83518693
Technical specialist Help Desk / IT cпециалист,200000 - 400000 KZT,Алматы,Paloma365,05-07-2023,with passion for technology (software and etc). - with Ability to work independently and passion to learn. - who are ready to...,You will be collaborating with a diverse team including both technical and business people across the world with the purpose...,,Нет опыта,Полная занятость,https://hh.ru/vacancy/83006449
Специалист по IT (мкр. Жулдыз),200000 KZT,Алматы,Global Foods,03-07-2023,Знание на уровне администратора программ семейства MS. Умение диагностировать оборудование. Стрессоустойчивость. Умение объяснять и слушать. Обучаемость. Возможность приезжать на работу...,"Поддержка инфраструктуры офиса. Обновление налоговых программ, СОНО. Настройка кабинета налогоплательщика. Поддержка ПО Агент плюс и Optimum (Программы для торговых представителей). ",,От 1 года до 3 лет,Полная занятость,https://hh.ru/vacancy/82937737
IT Рекрутер,300000 - 400000 KZT,Алматы,Neocode,23-07-2023,Вы имеете опыт подбора в IT рекрутинге от 6 месяцев. Обладаете знаниями и навыками оценки soft skills. Умеете вести переговоры...,Разрабатывать и внедрять эффективные стратегии поиска для привлечения квалифицированных ИТ-<highlighttext>специалистов</highlighttext> по различным каналам. Ведение отчетности по процессу поиска и...,,От 1 года до 3 лет,Полная занятость,https://hh.ru/vacancy/83523279
IT-специалист,300000 - 300000 KZT,Алматы,Caspian Offshore Construction,21-07-2023,,"Обслуживание, настройка работоспособности офиса. Установка-настройка 1С Предприятие-Бухгалтерия. Настройка СОНО, КНП, ЭСФ, Банк-клиент, Телефония, локальная сеть и...",,От 3 до 6 лет,Полная занятость,https://hh.ru/vacancy/83790168
Ведущий IT специалист,,Алматы,Нурбанк,18-07-2023,"Всему сами научим, главное от вас желание работать. Требования: Базовое знание ПК. 1 ГОДА РАБОТЫ В БАНКОВСКОЙ СФЕРЕ, ЕСЛИ НЕТ...",Работать с pos-терминалами. Работать с банкоматами.,,От 1 года до 3 лет,Полная занятость,https://hh.ru/vacancy/83609070
Технический специалист IT отдела,,Алматы,Finenex,21-07-2023,Высшее или среднее образование в сфере IT. Знание и опыт работы с ПК. Знание языков казахского и русского языка. ,Техническое сопровождение и обеспечение работоспособности ПО и оборудования. Поддержка и устранение технических проблем ПО и оборудования. Обучение клиентов и сопровождение...,,От 1 года до 3 лет,Полная занятость,https://hh.ru/vacancy/83793180
Специалист IT,,Атырау,Инфинити Орда,10-07-2023,Опыт работы с программой R-Keeper. Опыта работы на аналогичной должности от 3 лет. Опыта установки и настройки ОС Windows...,"Администрирование Windows серверов 2008 R2, 2012 R2, 2016-2019. Администрирование Next Cloud, Cloud Linux. Настройка Wi-Fi сети...",,От 3 до 6 лет,Полная занятость,https://hh.ru/vacancy/83198849
Специалист по IT и видеонаблюдению,200000 - 300000 KZT,Усть-Каменогорск,УК ТРК,09-07-2023,"Опыт работы с торговым оборудованием ТСД, сканера штрихкодов, фискальные регистраторы, весы с печатью этикеток, принтеры чеков. Навыки и опыт работы...","Монтаж и настройка оборудования (Видеонаблюдение, СКС, СКУД). Проектирование ЛВС. Обслуживание и ремонт систем видеонаблюдения, сетей электроснабжения (кабельные линии, слаботочных систем...",,От 1 года до 3 лет,Полная занятость,https://hh.ru/vacancy/83184984
Специалист по IT,170000 KZT,Павлодар,Logitex,26-06-2023,"Высшее/ средне-специальное образование в сфере IT. Опыт работы в сфере IT от 1 года. Коммуникабельность, стрессоустойчивость, целеустремленность.","Проведение системно-технического обслуживания парка компьютеров. Настройка компьютерного и периферийного оборудования. Установка и настройка OC Windows. Монтаж, установка систем безопасности...",,От 1 года до 3 лет,Полная занятость,https://hh.ru/vacancy/82380335
Специалист IT / Системотехник,,Астана,Учреждение Международная школа Spectrum,23-07-2023,Образование: Профильное образование в сфере IT. Опыт работы: не менее 1 года. Знание языков: владение казахским и английским языками (уровень...,Техническое сопровождение и обеспечение работоспособности it-инфраструктуры организации. Настройка компьютерного и периферийного оборудования. Установка и настройка OC Windows. ,,От 1 года до 3 лет,Полная занятость,https://hh.ru/vacancy/83559422
Специалист по IT,150000 - 380000 KZT,Алматы,Ваш Домофон,25-06-2023,,"Настройка сетевого оборудования (Asus, Mikrotik,Ubiquiti). Обслуживание ПК, оргтехники. Обслуживание систем Видеонаблюдения и IP домофонии. Выполнение поставленных задач.",,От 1 года до 3 лет,Полная занятость,https://hh.ru/vacancy/82368588
IT Project Manager,300000 - 500000 KZT,Алматы,NiDGE,21-07-2023,"Опыт работы с инструментами управления проектами (например, Trello, ClickUP). Навыки управления командой <highlighttext>специалистов</highlighttext>. Отличные коммуникативные навыки и способность эффективно работать...","Планирование и координация работы над проектами, отвечая за сроки, бюджет и качество выполнения. Организация работы команды <highlighttext>специалистов</highlighttext>, распределение задач и...",,От 1 года до 3 лет,Полная занятость,https://hh.ru/vacancy/83802793
