title,salary,city,job,publish_date,requirements,responsibilities,schedule,experience,employment,url
Специалист по внедрению и поддержке систем IT,,Алматы,Alina Group,21-07-2023,Высшее образование (желательно: информационные технологии). Опыт работы в технической поддержке от 2 лет. Семейство» офисного программного обеспечения и операционных систем...,"Устанавливать, настраивать и поддерживать персональные компьютеры, периферийное оборудование и программное обеспечение рабочих мест сотрудников Товарищества, а также своевременно выявлять и...",,От 3 до 6 лет,Полная занятость,https://hh.ru/vacancy/83799183
Специалист IT отдела в с. Аксукент,220000 KZT,Шымкент,Нурбанк,18-07-2023,Высшее техническое/математическое образование. Иное высшее при наличии опыта работы не менее 5 лет по специальности в области информационных технологий. ,"Организация, координация и контроль эффективной работы отдела. Обеспечение сопровождения и мониторинга обмена данными в части коммуникаций для бесперебойной работы ИСУБД...",,От 1 года до 3 лет,Полная занятость,https://hh.ru/vacancy/83597254
Специалист по IT/системный администратор,400000 - 480000 KZT,Караганда,ДЕДОВ,23-07-2023,"На должность IT-<highlighttext>специалиста</highlighttext> принимается лицо, имеющее высшее профессиональное (математическое, инженерно-математическое, техническое) образование и стаж работы по специальности в...","Работа с программой 1С.Предприятие: администрирование, сопровождение и внедрение программ, установка и обновление платформы, обновление не типовой конфигурации УПП, разработка новых...",,От 1 года до 3 лет,Полная занятость,https://hh.ru/vacancy/83254660
Intern / Specialist in Financial Audit IT Group,,Алматы,EY (Ernst & Young),21-07-2023,Higher technical education (IT). Good English (verbal/writing). Good knowledge of MS Office. Advanced user of Excel. Presentation skills. ,Participation in the audit of information systems in the framework of financial audit.,,Нет опыта,Стажировка,https://hh.ru/vacancy/83802455
IT рекрутер,,Астана,TargetAI Limited,13-07-2023,"Что точно нужно уметь и понимать, чтобы мы договорились: Хорошо говорить и уметь убеждать (например, опыт в ИТ подборе, продажах...","Основное: помогать мне с поиском и отбором кандидатов на сложные вакансии (Технические, тим и техлиды, редкие <highlighttext>специалисты</highlighttext> по ИТ направлениям...",,От 1 года до 3 лет,Полная занятость,https://hh.ru/vacancy/83391249
Специалист по IT,150000 KZT,Петропавловск,Барс - NORD,05-07-2023,Образование средне-спец. высшее. * Опыт работы желателен (при отсутствии опыта работы - образование обязательно). * Знание программного обеспечения.,"Обеспечение бесперебойной и корректной работы сетевого оборудования вычислительной техники, оргтехники. Оперативное выполнение всех связанных с этим технических задач. ",,Нет опыта,Полная занятость,https://hh.ru/vacancy/83022495
Технический специалист (IT),200000 - 300000 KZT,Алматы,Sulpak,13-07-2023,Образование или опыт работы в сфере IT. Желание работать с людьми. Желание учиться новому.,"Установка программного обеспечения. Кассовые операции. Настройка цифровой техники. Оформление доставки и установки товара. Оформление возврата, обмена товара. Выдача интернет-заказов. ",,От 1 года до 3 лет,Полная занятость,https://hh.ru/vacancy/81937021
IT-специалист / Веб-дизайнер / Фронтенд-разработчик,200000 KZT,Шымкент,PHYTO-APIPHARM,13-07-2023,"1. Опыт работы на аналогичной должности не менее 2-3 лет. 2. Глубокие знания HTML, CSS, и JavaScript. 3. ","1. Обеспечивать надлежащее функционирование и обслуживание компьютеров и оргтехники в организации. 2. Разрабатывать и поддерживать веб-сайт компании, обеспечивая удобный...",,От 1 года до 3 лет,Полная занятость,https://hh.ru/vacancy/83394729
Специалист по IT,,Алматы,Qamalladin Media,24-07-2023,"1) Установка и администрирование операционных систем: Знание и опыт в установке, настройке и обслуживании различных операционных систем, таких как Windows...","3) Знание о настройке и обслуживании серверов, включая установку операционных систем, настройку служб и ролей сервера, управление хранилищем данных и...",,От 1 года до 3 лет,Полная занятость,https://hh.ru/vacancy/83912125
Product manager медицинских IT проектов,,Астана,iDala,26-06-2023,"В своей работе мы стараемся использовать самые инновационные средства, подходы и методики, постоянно развиваемся, быстро принимаем решения и никогда не...","Постоянно взаимодействует с командой, ставит задачи, решает текущие проблемы, поддерживает мотивацию, привлекает аутсорс-<highlighttext>специалистов</highlighttext> при загрузке основной команды. ",,От 1 года до 3 лет,Полная занятость,https://hh.ru/vacancy/82384126
IT-специалист,200000 - 250000 KZT,Алматы,Юридическое агентство Правозащита,24-07-2023,"1. Отличное знание операционных систем и программных продуктов Microsoft, пакета Office, базовые знания по семейству протоколов TCP/IP. 3. ","1. Установка, настройка и администрирование операционных систем и сетевого программного обеспечения, рабочих станций, антивирусного программного обеспечения. 2. Администрирование информационных систем...",,От 1 года до 3 лет,Полная занятость,https://hh.ru/vacancy/83909362
Менеджер по продажам IT услуг,,Алматы,Первый БИТ,04-07-2023,"Опыт работы в продажах. Нацеленность на профессиональное развитие, результат и высокий доход. Умение выстраивать коммуникацию и быстро обучаться. ","...предложения, акции, мероприятия). Встречи и демонстрации по необходимости. Организация выездных работ IT-<highlighttext>специалистов</highlighttext> по запросу клиента. Полное документальное сопровождение сделки.",,От 1 года до 3 лет,Полная занятость,https://hh.ru/vacancy/81709418
IT-специалист,,Астана,Home Credit Bank,03-07-2023,,,,От 1 года до 3 лет,Полная занятость,https://hh.ru/vacancy/82917813
Технический специалист (IT),180000 - 250000 KZT,Экибастуз,Sulpak,21-07-2023,Образование или опыт работы в сфере IT. Желание работать с людьми. Желание учиться новому.,"Установка программного обеспечения. Кассовые операции. Настройка цифровой техники. Оформление доставки и установки товара. Оформление возврата, обмена товара. Выдача интернет-заказов. ",,От 1 года до 3 лет,Полная занятость,https://hh.ru/vacancy/83804332
IT рекрутер,,Алматы,One technologies,23-07-2023,Опыт проведения собеседований на различные вакансии (от <highlighttext>специалистов</highlighttext> до менеджеров высшего звена) желательно с применением интервью по компетенциям. ,Подбор персонала на позиции разного уровня(business/IT). Эффективное взаимодействие с интервьюерами. Сопровождение кандидатов на всех этапах подбора. ,,От 1 года до 3 лет,Полная занятость,https://hh.ru/vacancy/83554357
Специалист по IT,220000 - 220000 KZT,Астана,Astek-auto,11-07-2023,Опыт работы на аналогичной должности не менее 1 года. Приветствуется опыт работы с системами видеонаблюдения. Профильное образование в сфере IT...,"Осуществлять бесперебойную техническую и программную поддержку сотрудников. Обеспечивать работу оборудования (компьютеры, принтеры, сетевые устройства). Осуществлять установку и настройку программного обеспечения. ",,От 1 года до 3 лет,Полная занятость,https://hh.ru/vacancy/83258848
Специалист по IT,,Усть-Каменогорск,Аграрная кредитная корпорация,11-07-2023,"Высшее или среднее специальное образование по заявленной специальности. В профессиональной сфере или в областях, соответствующих функциональным направлениям должности – стаж работы...",Создание программного обеспечения для решения поставленных задач. Разработку операционных систем и оболочек для баз данных. Техническую поддержку и сопровождение ПО...,,От 1 года до 3 лет,Полная занятость,https://hh.ru/vacancy/83289454
Специалист по продажам в категории IT Департамента Коммерции,,Алматы,TECHNODOM Operator (Технодом Оператор),21-07-2023,"Высшее образование. Опытный пользователь ПК, Excel, Power Point. Аналитические способности: анализ продаж, рынка, трендов, прогнозирование. Коммуникабельность, адаптивность, стрессоустойчивость, обучаемость.","Качественное распределение товаров курируемых категорий по магазинам с учетом продаж, логистики, частоты поставок. Умение планировать объемы для оптимальной транспортировки. ",,От 1 года до 3 лет,Полная занятость,https://hh.ru/vacancy/83800803
IT рекрутер,,Алматы,Ventra,05-07-2023,"Высшее образование. Опыт в сфере ИТ подбора от 2х лет. Знание английского языка. Рассмотрим кандидатов, которые находятся сейчас за...","Поиск <highlighttext>специалистов</highlighttext> в ИТ-сфере (позиции от стажеров до том-менеджмента) за рубежом. Анализ рынка, определение стратегии поиска (применение различных...",,От 1 года до 3 лет,Полная занятость,https://hh.ru/vacancy/83019517
"Специалист IT по раскрутке строительного магазина, ведению и продвижению сайта",200000 - 200000 KZT,Астана,Damustroi,03-07-2023,Знания 1С бухгалтерий.,"Ведение и продвижения сайта строительного магазина,Ведение площадки сату,Каспий магазина,Инстаграм акаунта,привлечение новых клиентов.",,От 1 года до 3 лет,Полная занятость,https://hh.ru/vacancy/82890187
Технический специалист (IT),230000 - 330000 KZT,Астана,Sulpak,29-06-2023,Образование или опыт работы в сфере IT. Желание работать с людьми. Желание учиться новому.,"Установка программного обеспечения. Кассовые операции. Настройка цифровой техники. Оформление доставки и установки товара. Оформление возврата, обмена товара. Выдача интернет-заказов. ",,От 1 года до 3 лет,Полная занятость,https://hh.ru/vacancy/82723186
Специалист по IT,150000 - 300000 KZT,Павлодар,Ваш Домофон,24-07-2023,,"Настройка сетевого оборудования (Asus, Mikrotik,Ubiquiti). Обслуживание ПК, оргтехники. Обслуживание систем Видеонаблюдения и IP домофонии. Выполнение поставленных задач.",,От 1 года до 3 лет,Полная занятость,https://hh.ru/vacancy/82497988
Менеджер программ и коммерциализации в образовательном IT проекте,,Астана,Корпоративный фонд Международный технопарк IT-стартапов «Astana Hub»,24-07-2023,"Человека с базовыми навыками дизайна и отличными презентационными навыками. Исполнителя, знающего методологию Agile и Scrum. Многоязычного <highlighttext>специалиста</highlighttext> (казахский, русский, английский).",Организация и сопровождение образовательных программ. Продажа образовательных программ через каналы B2B/B2C. Мониторинг текущих процессов и...,,От 3 до 6 лет,Полная занятость,https://hh.ru/vacancy/83910951
Специалист по IT,100000 - 200000 KZT,Атырау,М-Системс групп,12-07-2023,Знание компьютерного железа. Знание 1С. Знание серверов. Мини АТС.,"Ремонт компьютеров. Восстановление систем. Прокладка,монтаж СКС.",,От 1 года до 3 лет,Полная занятость,https://hh.ru/vacancy/83334474
Технический специалист (IT),200000 - 300000 KZT,Костанай,Sulpak,11-07-2023,Образование или опыт работы в сфере IT. Желание работать с людьми. Желание учиться новому.,"Установка программного обеспечения. Кассовые операции. Настройка цифровой техники. Оформление доставки и установки товара. Оформление возврата, обмена товара. Выдача интернет-заказов. ",,От 1 года до 3 лет,Полная занятость,https://hh.ru/vacancy/83271900
Специалист IT,,Уральск,Инфинити Орда,10-07-2023,Опыт работы с программой R-Keeper. Опыта работы на аналогичной должности от 3 лет. Опыта установки и настройки ОС Windows...,"Администрирование Windows серверов 2008 R2, 2012 R2, 2016-2019. Администрирование Next Cloud, Cloud Linux. Настройка Wi-Fi сети...",,От 3 до 6 лет,Полная занятость,https://hh.ru/vacancy/83198850
Специалист по IT,,Шымкент,T.A.S.-Медиа,01-07-2023,"Специальное образование, опыт работы в IT сфере. Навыки работы с серверным оборудованием, локальными сетями. Знание аппаратной части персональных компьютеров, умение...","Настройка сетевого оборудования. Монтажные работы (проведение проводки, телефонной связи и т.п). Обслуживание ПК, оргтехники. Обслуживание систем Видеонаблюдения.",,От 3 до 6 лет,Полная занятость,https://hh.ru/vacancy/82865336
Специалист IT отдела,120000 KZT,Туркестан,Азия Сервис-Шымкент,04-07-2023,"Должен знать: Принципы работы OS Microsoft Windows. Технико-эксплуатационные характеристики, конструктивные особенности назначение и режимы работы оборудования, правила его технической...",Техническая поддержка пользователей. Обслуживание персональных компьютеров. Подключение и настройка периферийного оборудования. Заправка картриджей. Видеонаблюдение. Пожарно-охранная сигнализация. Принципы работы и...,,От 1 года до 3 лет,Полная занятость,https://hh.ru/vacancy/82945823
IT-специалист,200000 - 200000 KZT,Актау,Алтын Алма,12-07-2023,"Свободная установка ПО. Знание и возможности настройки ПО бухгалтерской и налоговой отчётности. Знание сетевых коммуникаций. Знание программ Windows, Office, налоговые...","Обеспечивать и поддерживать работоспособность сетевых коммуникаций, компьютерной и орг. техники, программное обеспечение Налоговой отчётности.",,От 1 года до 3 лет,Полная занятость,https://hh.ru/vacancy/82096139
Специалист по IT,150000 - 170000 KZT,Шымкент,CG Food Central Asia,10-07-2023,Опыт работы не менее 3-х лет в должности IT-<highlighttext>специалиста</highlighttext>. Основы администрирования серверов 1С. Знание следующих видов оборудования...,Поддержание внутренней и внешней сети офиса организации в рабочем состоянии. Установка и настройка серверного оборудования. Администрирование программы «1 С Бухгалтерия...,,От 3 до 6 лет,Полная занятость,https://hh.ru/vacancy/83198814
Специалист по IT,,Караганда,ALS Казгеохимия,23-07-2023,Опыт работы в сфере IT технологий не менее 3 лет. Высшее профессиональное или среднее техническое образование (информационные системы в бизнесе...,Контроль и установку программного обеспечения (software control & distribution). Управление заявками пользователей на обслуживание (incident management). Управление изменениями (change management): управление...,,От 3 до 6 лет,Полная занятость,https://hh.ru/vacancy/83284843
Технический специалист (IT),200000 - 300000 KZT,Алматы,Sulpak,29-06-2023,Образование или опыт работы в сфере IT. Желание работать с людьми. Желание учиться новому.,"Установка программного обеспечения. Кассовые операции. Настройка цифровой техники. Оформление доставки и установки товара. Оформление возврата, обмена товара. Выдача интернет-заказов. ",,От 1 года до 3 лет,Полная занятость,https://hh.ru/vacancy/82738893
Automation Specialist (IT Specialist),,Хромтау,Восход-Oriel,14-07-2023,"Bachelor’s degree in Electrical/Electronics Engineering, Computer Engineering or related fields. Minimum 2 years of work experience in low...","Managing the wiring, installation, testing and commissioning processes of electronic systems. Creating the calendars of the projects under his/her...",,От 1 года до 3 лет,Полная занятость,https://hh.ru/vacancy/83441313
Технический специалист (IT),180000 - 250000 KZT,Семей,Sulpak,17-07-2023,Образование или опыт работы в сфере IT. Желание работать с людьми. Желание учиться новому.,"Установка программного обеспечения. Кассовые операции. Настройка цифровой техники. Оформление доставки и установки товара. Оформление возврата, обмена товара. Выдача интернет-заказов. ",,От 1 года до 3 лет,Полная занятость,https://hh.ru/vacancy/83558170
Старший инженер IT,,Алматы,Школа-Гимназия ZERDE,23-07-2023,,При организации работ по обеспечению Компании телефонной и другой электронной связью <highlighttext>Специалист</highlighttext> обязан: - Оказание технической помощи и консультации филиалам Компании...,,От 3 до 6 лет,Полная занятость,https://hh.ru/vacancy/83750831
IT Helpdesk specialist,,Астана,"Deloitte, Caspian Region",13-07-2023,Higher technical education. Good knowledge of computer hardware and software. Practical knowledge of installation and maintenance of computers. ,Provide 1st level support to internal clients. Install and configure computers and other equipment. Develop end-user documentation. ,,От 1 года до 3 лет,Полная занятость,https://hh.ru/vacancy/79318636
