title,salary,city,job,publish_date,requirements,responsibilities,schedule,experience,employment,url
IT Support Specialist,,Астана,"Haileybury Astana School, НАО",23-07-2023,"Knowledge of personal computer systems, network systems, operating systems, data communications, software applications. Ability to conduct research, analyze, and track...","Serves as school resource for installing, maintaining, upgrading and troubleshooting standard application software and computer hardware for faculty, students and...",,От 1 года до 3 лет,Полная занятость,https://hh.ru/vacancy/83729512
Технический специалист (IT),230000 - 330000 KZT,Астана,Sulpak,27-06-2023,Образование или опыт работы в сфере IT. Желание работать с людьми. Желание учиться новому.,"Установка программного обеспечения. Кассовые операции. Настройка цифровой техники. Оформление доставки и установки товара. Оформление возврата, обмена товара. Выдача интернет-заказов. ",,От 1 года до 3 лет,Полная занятость,https://hh.ru/vacancy/82497599
Специалист по IT,180000 KZT,Актау,Каспий Авто Парк,11-07-2023,"Разрешает или ограничивает доступ к информации, определяет порядок и условия такого доступа.","Обеспечивает достоверность, защиту информации и своевременность ее предоставления. Осуществляет установку, настройку, техническое сопровождение и обслуживание оборудования и программного обеспечения организации. ",,От 3 до 6 лет,Полная занятость,https://hh.ru/vacancy/83253680
IT-product manager,800000 KZT,Алматы,Галерея Новостроек,23-07-2023,"Вы будете ответственны за: Вам предстоит проводить исследования рынка и валидацию, а Ваша экспертность и знание техник валидации продукта помогут...",Разработку продуктовой стратегии. Разработку финансовых моделей для продукта. Создание дорожных карт. Определение целей продукта и направления его развития. ,,Более 6 лет,Полная занятость,https://hh.ru/vacancy/83727275
Специалист по IT,,Алматы,"АстраЗенека ЮК Лимитед Казахстан, Представительство Компании",14-07-2023,"В случае необходимости выполнять прочие служебные задания, поручаемые руководством, в рамках своих профессиональных навыков, знаний и компетенций. Требования: Высшее техническое...","ИТ <highlighttext>специалист</highlighttext> обязан осуществлять ИТ поддержку сотрудников Общества: Осуществлять эффективную поддержку ИТ сервисов (Сервис печати, Сервис доступа в интернет и...",,От 3 до 6 лет,Полная занятость,https://hh.ru/vacancy/83439862
Менеджер по развитию клиентов (IT продукт),,Астана,DSSL,12-07-2023,Опыт работы в В2В продажах от года. Высшее образование (предпочтительно техническое). Опыт продаж решений в сфере ИТ или...,Телефону и при личных встречах с привлечением технических <highlighttext>специалистов</highlighttext>. При необходимости. Реализация мероприятий по поддержанию и увеличению количества. ,,От 1 года до 3 лет,Полная занятость,https://hh.ru/vacancy/83357637
Специалист по IT,230000 - 230000 KZT,Костанай,АО «Bank Freedom Finance Kazakhstan»,29-06-2023,"Высшее техническое образование. Опыт работы в банковской системе не менее 2-х лет. Знание администрирования Windows ( Active Directory, DNS, DHCP...","Обслуживание банковских сетей и программного обеспечения. Настройка, установка Windows, банковских продуктов, пос терминалов, банкоматов. - Осуществление технической и программной поддержки пользователей. - ",,От 1 года до 3 лет,Полная занятость,https://hh.ru/vacancy/82773496
Специалист IT отдела,80000 - 250000 KZT,Уральск,Кипер.KZ,24-07-2023,Обладает базовыми знаниями в IT. Свободное владение русским и казахскими языками. Любит работать с техникой. Обладает грамотной речью. ,"Осуществлять выездные работы к заказчику по вопросам ПО, так и по аппартной части. Оказание удаленной помощи клиентам тех.поддержки. ",,От 1 года до 3 лет,Полная занятость,https://hh.ru/vacancy/83602623
Менеджер по развитию клиентов (IT продукт),,Усть-Каменогорск,DSSL,12-07-2023,Опыт работы в В2В продажах от года. Высшее образование (предпочтительно техническое). Опыт продаж решений в сфере ИТ или...,Телефону и при личных встречах с привлечением технических <highlighttext>специалистов</highlighttext>. При необходимости. Реализация мероприятий по поддержанию и увеличению количества. ,,От 1 года до 3 лет,Полная занятость,https://hh.ru/vacancy/83357638
Системо-техник / IT-специалист,85000 KZT,Астана,Strong tea,22-07-2023,"Базовые знания компьютерной техники и устройства сетей. Внимательность к деталям. Ответственность, пунктуальность, добропорядочность.",Обслуживание и учет компьютерной техники и сетевого оборудования.,,От 1 года до 3 лет,Частичная занятость,https://hh.ru/vacancy/83374910
IT специалист / Технолог-конструктор мебели,200000 - 300000 KZT,Семей,Жакупбаев Даулет Кызырбекович Prime,22-07-2023,,,,От 3 до 6 лет,Полная занятость,https://hh.ru/vacancy/83383060
IT аналитик (банковское ПО),,Алматы,ЦФТ-Азия,27-06-2023,"Высшее (техническое, экономическое) образование. Опыт работы от 1 года в качестве бизнес- или системного аналитика с ПО в сфере финансов...","Анализ бизнес-требований кредитных организаций, проектирование решений, составление ТЗ для разработчика. Анализ изменений в нормативных актах, спецификация требований, передача разработчику...",,От 1 года до 3 лет,Полная занятость,https://hh.ru/vacancy/82527913
Специалист IT отдела,,Алматы,Sary-Arka Copper Processing,23-07-2023,Высшее/средне-профессиональное образование (техническое направление). Опыт работы системным/сетевым администратором от 1 года. Знание пакета приложений MS Office на...,"Техническая и консультационная поддержка рабочих мест пользователей (настройка и сопровождение ПО, телефонии, новых рабочих мест, оргтехники и периферийных устройств). ",,От 1 года до 3 лет,Полная занятость,https://hh.ru/vacancy/83726290
Менеджер по работе с клиентами It сфера,150000 KZT,Алматы,Первый БИТ,21-07-2023,Имеешь опыт в продажах (будет являться преимуществом) или хочешь в продажи без опыта (мы научим). Живой интерес к сфере продаж...,"Телефонные переговоры, проведение встреч, составление коммерческих предложений, Согласование плана действия по клиентам с техническими <highlighttext>специалистами</highlighttext>; заключение договоров. Выполнение ежемесячного плана...",,Нет опыта,Полная занятость,https://hh.ru/vacancy/83394785
Специалист по IT,210000 KZT,Алматы,СТАТУС construction,23-07-2023,Опыт установки и обслуживания компьютерных систем и оргтехники. Опыт настройки программного обеспечения. Высокая ответственность и работоспособность.,"Администрирование сетевого оборудования. Техническая поддержка пользователей. Мониторинг работы серверов,поддержка бесперебойной работы офисной техники.",,От 1 года до 3 лет,Полная занятость,https://hh.ru/vacancy/83037368
Ведущий менеджер по продажам (IT сфера),,Алматы,Первый БИТ,24-07-2023,"Опыт работы в продажах. Нацеленность на профессиональное развитие, результат и высокий доход. Умение выстраивать коммуникацию и быстро обучаться. ","...предложения, акции, мероприятия). Встречи и демонстрации по необходимости. Организация выездных работ IT-<highlighttext>специалистов</highlighttext> по запросу клиента. Полное документальное сопровождение сделки.",,От 1 года до 3 лет,Полная занятость,https://hh.ru/vacancy/83925501
Специалист по IT,150000 - 270000 KZT,Шымкент,Ваш Домофон,22-07-2023,,"Настройка сетевого оборудования (Asus, Mikrotik,Ubiquiti). Обслуживание ПК, оргтехники. Обслуживание систем Видеонаблюдения и IP домофонии. Выполнение поставленных задач.",,От 1 года до 3 лет,Полная занятость,https://hh.ru/vacancy/78937556
Специалист по IT,250000 - 300000 KZT,Алматы,Бизнес парк Станица,03-07-2023,"2. Знание Linux (Ubuntu, CentOS, Debian), требуемый минимум: Установка пакетов из репозитория. Знание расположения конфигурационных файлов. Назначение разрешений для файлов. ",Создание пользователей и групп. Назначение разрешений для файловой системы NTFS. Применение групповых политик. Управление учетными записями почтовых серверов и Active...,,От 3 до 6 лет,Полная занятость,https://hh.ru/vacancy/82888666
Менеджер по развитию клиентов (IT продукт),,Атырау,DSSL,12-07-2023,Опыт работы в В2В продажах от года. Высшее образование (предпочтительно техническое). Опыт продаж решений в сфере ИТ или...,Телефону и при личных встречах с привлечением технических <highlighttext>специалистов</highlighttext>. При необходимости. Реализация мероприятий по поддержанию и увеличению количества. ,,От 1 года до 3 лет,Полная занятость,https://hh.ru/vacancy/83357636
IT-специалист,,Усть-Каменогорск,ЭЙКОС,05-07-2023,Знание компьютеров и оргтехники.,"Обслуживание компьютеров (устранение неполадок, установка ПО), офисной техники. Заправка картриджей, связь.",,От 1 года до 3 лет,Полная занятость,https://hh.ru/vacancy/83002728
Менеджер по развитию клиентов (IT продукт),,Шымкент,DSSL,12-07-2023,Опыт работы в В2В продажах от года. Высшее образование (предпочтительно техническое). Опыт продаж решений в сфере ИТ или...,Телефону и при личных встречах с привлечением технических <highlighttext>специалистов</highlighttext>. При необходимости. Реализация мероприятий по поддержанию и увеличению количества. ,,От 1 года до 3 лет,Полная занятость,https://hh.ru/vacancy/83357639
IT- специалист по кинооборудованию / Киномеханик,120000 - 150000 KZT,Алматы,«Capital Cinema» ТМ Cinema Hotel Corporation,27-06-2023,"Высшее/среднее профессиональное техническое IT образование (предпочтительно). Опыт работы IT-<highlighttext>специалистом</highlighttext> (предпочтительно). Ответственный, дисциплинированный и легко обучаемый, разбирающийся в технических...",Демонстрация фильмов (обеспечение качественного и своевременного кинопоказа). Ежедневное выполнение технического осмотра (ТО-1). Замена в кинопроекторах необходимых элементов. ,,От 1 года до 3 лет,Полная занятость,https://hh.ru/vacancy/80401859
IT-специалист,,Уральск,Фирма Сервер +,30-06-2023,"Профессиональные навыки: Умение работать с паяльником, мультиметром - весьма приветствуется. Опыт работы с мини - АТС и SIP-телефонией - приветствуется. ","Компонентный ремонт и диагностика ПК, принтеров. Установка, настройка ОС и ПО. Прокладка и настройка СКС. Ведение IT – документации. ",,От 1 года до 3 лет,Полная занятость,https://hh.ru/vacancy/82844606
Менеджер по работе с клиентами It сфера,150000 KZT,Костанай,Первый БИТ,21-07-2023,Имеешь опыт в продажах (будет являться преимуществом) или хочешь в продажи без опыта (мы научим). Живой интерес к сфере продаж...,"Телефонные переговоры, проведение встреч, составление коммерческих предложений, Согласование плана действия по клиентам с техническими <highlighttext>специалистами</highlighttext>; заключение договоров. Выполнение ежемесячного плана...",,Нет опыта,Полная занятость,https://hh.ru/vacancy/83656881
IT Специалист отдела поддержки 1С,80000 - 200000 KZT,Алматы,ВЦ Интеграция,24-07-2023,"Активная жизненная позиция, позитивный настрой. Работа на результат. Обучаемость. Коммуникабельность, инициативность, стрессоустойчивость. Ответственность и желание добиваться результатов. Пунктуальность. ",Работа по поддержке и сопровождению корпоративных клиентов компании. Устанавливать и обеспечивать бесперебойную работоспособность компьютерного оборудования и программного обеспечения клиентов компании. ,,От 1 года до 3 лет,Полная занятость,https://hh.ru/vacancy/83912816
IT Рекрутер,,Алматы,Bereke Bank,05-07-2023,Опыт работы в направлении рекрутинга не менее 2-х лет (или от 1 года по IT рекрутингу). Знакомство с различными...,"...onboarding, участие в адаптации, exit interview. Разрабатывать и внедрять эффективные стратегии поиска для привлечения квалифицированных ИТ-<highlighttext>специалистов</highlighttext> по различным каналам.",,От 1 года до 3 лет,Полная занятость,https://hh.ru/vacancy/83040704
IT Business Applications Support Expert,,Алматы,Amway Казахстан,17-07-2023,Relative experience as IT BA Support <highlighttext>Specialist</highlighttext>: 5+ years. Knowledge and experience with logistic processes and information systems. ,"Changes implemented/monitored first time right. Coordinate availability, performance, security, issues and change requests on application/system level. ",,Более 6 лет,Полная занятость,https://hh.ru/vacancy/82420870
IT-специалист,,Усть-Каменогорск,АО «Bank Freedom Finance Kazakhstan»,11-07-2023,"Образование: высшее, неполное высшее, средне-специальное. Специальность- техническая. Опыт работы по данному направлению и сертификатов приветствуются. Знания, умения и навыки...","Установка/замена орг. техники, запасных частей к ним. Установка и обновления стандартного ПО. Проведение профилактических работ сетевого оборудования. ",,От 1 года до 3 лет,Полная занятость,https://hh.ru/vacancy/83251167
IT Специалист,,Алматы,Caspian International Restaurants company,30-06-2023,Ответственность: Опыт работы в сфере ИТ в ресторане/гостиничном бизнесе. Степень бакалавра в области информационных технологий или другой бизнес-дисциплины. ,"Аналитик работает в соответствии с планами активностей и графиком проектов по согласованию с руководителем группы. Аналитик, несет ответственность за предоставление...",,От 1 года до 3 лет,Полная занятость,https://hh.ru/vacancy/82839586
"Главный специалист IT (Алматинская область, Отеген Батыр)",,Отеген-Батыр,QazCloud,19-07-2023,Среднее (профессиональное) или высшее образование. Отличное знание железа ПК (сборка-разборка). Навыки диагностики и устранения неполадок с сетью. ,"Работать по заявкам на обслуживание от сотрудников в режиме Helpdesk. Оперативное устранение всех типов неисправностей, возникающей при работе с оборудованием...",,От 1 года до 3 лет,Полная занятость,https://hh.ru/vacancy/83659929
Технический специалист (IT),180000 - 250000 KZT,Семей,Sulpak,22-07-2023,Образование или опыт работы в сфере IT. Желание работать с людьми. Желание учиться новому.,"Установка программного обеспечения. Кассовые операции. Настройка цифровой техники. Оформление доставки и установки товара. Оформление возврата, обмена товара. Выдача интернет-заказов. ",,От 1 года до 3 лет,Полная занятость,https://hh.ru/vacancy/81938568
Hospitality Software IT Specialist,,Алматы,HRS,20-07-2023,"IT background preferrable. Open minded, eager to learn new knowledge in inventory management and IT. Communicative, ready to travel. ","Software installation (Spa and hospitality industry). Provide telephonic / remote / onsite support for IT products, QA skills advantageous. Ensure accurate and...",,От 1 года до 3 лет,Полная занятость,https://hh.ru/vacancy/83771641
IT Архитектор (Enterprise Architect),,Алматы,Рэдмэдробот Центральная Азия,10-07-2023,Опыт работы в должности архитектора или руководителя проектов с акцентом на продаже в области разработки программного обеспечения. Глубокие знания и...,Взаимодействие с командой разработчиков и техническими <highlighttext>специалистами</highlighttext> для обеспечения успешной реализации проектов. Проведение технических аудитов ИТ-ландшафта клиента с целью...,,Более 6 лет,Полная занятость,https://hh.ru/vacancy/83195535
IT Specialist,,Актау,ФЕНИКС ИНТЕРНЕШНЛ РЕСОРСИЗ КАСПИАН,14-07-2023,"A high school diploma or equivalent is typically required. A relevant associate or bachelor’s degree in computer science, information...","Aktau, 5\2.",,От 1 года до 3 лет,Полная занятость,https://hh.ru/vacancy/81874674
IT Специалист 1С программист,350000 - 430000 KZT,Алматы,"ProMebel, ТМ (ТОО IDIA Market)",22-07-2023,"Вас отличают такие качества как трудолюбие и целеустремленность. Вы учились с высокой успеваемостью. Техническое образование. Ответственность, умение работать в команде.","Обслуживание клиентских программ (конфигурация, кастомизация, upgrade клиентских программ под требования проекта). Автоматизация бизнеса. Установка и обучение программы 1С для...",,От 1 года до 3 лет,Полная занятость,https://hh.ru/vacancy/83379912
IT Specialist,,Алматы,Зенюк К. Н.,21-07-2023,having a minimum of commercial experience. - English level B2 and higher. - readiness to improve knowledge and develop technical skills.,work with a European customer. - support at all stages of the interview. The client and the project will be matched...,,От 1 года до 3 лет,Полная занятость,https://hh.ru/vacancy/82917553
